date,text,likes,retweets
2019-10-26 21:03:49,The previous bull market lasted 152 weeks \n\nThat\'s 1064 days \n\nAlmost 3 years \n\nWe are only 29 weeks into the new Bull Market\n\n#Bitcoin has just reversed from its first major Bull Market correction\n\nAnd recently rallied +40% over the past 2 days\n\n$BTC #Crypto,415,77
2019-10-26 17:57:11,What if...\n\n#Bitcoin $BTC pic.twitter.com/ZmijsJXlfZ,32,2
2019-10-26 12:24:39,"Pretty healthy retrace of 45-50% for the overall market, breaking out upwards again and likely continuing to the upside. \n\nAmazing flip on the total market capitalization chart as well, leaving this the most obvious beartrap of them all. \n\n$BTC #BITCOIN pic.twitter.com/0zpj3WIJpY",145,25
2019-10-26 18:47:51, Seed planted! \n\n Here\'s to some warmer Las Vegas seed planting in the near future! \n\nhttp://changeangel.io/plant-a-seed \n\n#crypto #cryptocurrency #bitcoin $btc #litecoin $ltc #litecoinsummit2019 #wccpic.twitter.com/eIVSxzu2AW,25,10
2019-10-26 22:55:00,BitcoinCore is NOT Bitcoin\n#BTC \'Educators/believers\' lack knowledge\n\nBitcoinSV Blockchain follows WhitePaper and is the Original Scalable #bitcoin #BSV with:\nBIG Blocks\nInstant Transactions\nLow Fees\nSmart Contracts\nRegularly Friendly\nFor Large Enterprises\nhttp://www.BitcoinSV.com pic.twitter.com/U6ysul6EFH,24,6
2019-10-26 14:01:15,"Apollo Facts\nA dose of Apollo facts you did and didn\'t know!\n\nFact #86\nDuring the height of Hyperinflation in Zimbabwe from 2008 to 2009, the inflation rate is estimated at 79.6 billion percent month-on-month, 89.7 sextillion percent...\n\n#apl #bitcoin #btc #cryptocurrency #Walletpic.twitter.com/7epqQOjChL",216,117
2019-10-26 21:32:53," Bitcoin just beat its own historic record in daily volume:\n\n$48.6 billion USD in 24H trading volume October 26 - an official new All Time High in Daily Bitcoin Volume since BTC\'s inception in 2009\n\nPrevious record was $46.4B from June 27, 2019\n\nLong #Bitcoin. Long #Blockchain.pic.twitter.com/2SejJ26QGC",159,64
2019-10-26 21:27:24," $211,000 #Bitcoin - Jan 2021\n\nhttps://youtu.be/uw2SLMc6eL8 \n\n#BTC $BTC $Bitcoin Price Prediction pic.twitter.com/257nlKaGaP",34,8
2019-10-26 15:40:34,$BTC  Like Magic  \n-> a direct bounce off of the 61.8 Fib  \nLooking good so far ... \n#Bitcoin #BTC #Crypto #cryptotwitter #Fibonacci #cryptowatchpic.twitter.com/pcQoqxrYGu,67,5
2019-10-26 23:56:05,Are we in wave 3? #BITCOIN $BTC The probability of this scenario taking place is between 60% and 70% pic.twitter.com/Q0Vi40kjk7,3,1
2019-10-26 22:50:10,Bitcoin price surged from $7600 to $10500 in less than 24 hours? Did anyone see that in TA? #bitcoin #BTC #TA #Technicalanalysis,3,2
2019-10-26 23:17:52,"#LightningNetwork \n\nhttp://1ML.com  observed:\n10,278 nodes (5,915 with active channels)\n35,308 channels\n822.543 BTC capacity ($7,578,189)\n\nmedian node capacity: 0.005 BTC ($45.85)\n\npast 24h:\n+6 nodes +66 channels -1.665 BTC ($-15,343)\n\n#Lightning #LN #bitcoin $BTC",22,5
2019-10-26 23:53:05,"As of October 25, 2019 at 06:53PM, 1 XRP = 0.2919 USD.  https://goo.gl/E2Ee6A   #Investing #fire #ira #401k #money #stock #retirement #trade #NeverWorkAgain #CapitalGain #Savings #PersonalFinance #crypto #ethereum #eth #bitcoin #btc #xrp #ripple",1,0
2019-10-26 22:30:24,MoneyGram Pushing to Launch Ripple\'s XRP-Powered Cross-Border Payments Platform Worldwide \nhttps://dailyhodl.com/2019/10/26/moneygram-pushing-to-launch-ripples-xrp-powered-cross-border-payments-platform-worldwide/ \xe2\x80\xa6\n\n#FCoin #FCoinJP #FCoinEurope #FMEX #Bitcoin #BTC #ETH #XRP #TRX #Crypto,4,2
2019-10-26 18:31:17,Want to know what Xi Jingping actually said about blockchain? I found this helpful. #blockchain #bitcoin $BTC https://medium.com/@mablejiang/xi-jinpings-speech-at-the-18th-collective-study-of-the-chinese-political-bureau-of-the-central-1219730677b2 \xe2\x80\xa6,3,0
2019-10-26 13:35:27,Levels i am watching right now:\n\n9350\n9100\n8800\n\n#bitcoin $BTC,19,0
2019-10-26 19:10:11,The adoption of volatile cryptocurrencies might not be so straightforward as you might think. Can they be adopted via price speculation or rather via real usage?\n\nRead more in our article:\nhttps://medium.com/@CardaniansI/will-the-majority-adopt-sooner-bitcoin-or-cardano-cd5bf3ee8db2 \xe2\x80\xa6\n\n#blockchain #Cardano #bitcoin $ada $btc $xrp #crypto $eth $xrp,46,5
2019-10-26 15:45:50,All the people in my twitter feed praising #XiJinping just because the value of their $btc went up are making the same mistake as #LeBronJames. Totally blinded by their wallets and short term greed. That isn\xe2\x80\x99t the community I want to be a part of. #bitcoin #china #btc,17,3
2019-10-26 15:38:24,Follow-up question:\n\nDid he mention bitcoin or any other crypto? \n\n#Crypto #bitcoin $btc,3,0
2019-10-26 15:46:00," $BTCUSD weekly showing my [Orange & Magenta] ""TIME Reversal Point"" patterns.\n\nThe Orange RP4 Low is late due to the pull down of the Magenta RP3 Low.\n\nThese two patterns REPEAT EVERY 4 YEARS.\n\nhttps://TheDaedalusReport.com/LEARN                  \n\n#BITCOIN #BTC $BTC $LTC $ETHpic.twitter.com/nyWHycN0vl",3,1
2019-10-26 12:34:16,"#kwontikTA #bitcoin $btc monthly\n\nThus far, bitcoin has respected this bullish flag formation / descending channel, despite the recent insane volatility. Breaking this 4 months old pattern will signal when bitcoin takes things to the next level. Keep a close watch on this too. pic.twitter.com/k4KtNKDBGx",0,0
2019-10-26 15:07:17,Go for #handicapper with proven record and over 30 years of experience! Check out this page! \nhttps://cobrasportspicks.com  \n#sportsbetting #gambling #cryptocurrency #bitcoin #btc #betting #sportstrading @Cobrasportspickpic.twitter.com/cOzhQPrgwW,4,5
2019-10-26 18:07:54,How to Use Bitcoin ATM in 2019 | A Step by Step Guide - http://bit.ly/36cfOXY \n #bitcoin #btc #bitcoinnews #blockchainpic.twitter.com/zR4hC7AKIL,2,0
2019-10-26 12:58:32,"Forget China\xe2\x80\x94Is This The Real Reason Bitcoin, Ethereum, Litecoin, And Ripple\xe2\x80\x99s XRP Bounced? http://j.mp/31PuJnt  #Bitcoin $BTC $ETH $Cryptopic.twitter.com/sFI3sM1DDR",3,1
2019-10-26 18:49:12,\xe2\x82\xbf  Ripple Initiative Aims to Make XRP The Amazon AWS of Money l bitcoin: https://www.youtube.com/watch?v=n2B51V0zq10 \xe2\x80\xa6\n\n#bitcoin $btc #bitcoinnews #bitcoinnewstoday #cryptonews #cryptonewstoday #cryptocurrency #cryptocurrencynews #cryptocurrencynewstoday #VeChain,3,2
2019-10-26 15:10:45,I should launch a prophecy lol\n\n#bitcoin $BTC pic.twitter.com/yLcueMguxA,5,0
2019-10-26 15:24:38,My proven record and over 30 years of experience is what sets me apart from other #handicappers! Check out my #winningpicks packages and start #winning! \nhttps://cobrasportspicks.com  \n#sportsbetting #gambling #cryptocurrency #bitcoin #btc #betting #sportstradingpic.twitter.com/QbxPmYioIU,6,5
2019-10-26 11:35:52,Our featured article for today! Please don\'t forget to subscribe to our daily newsletter at http://fintechnewshub.com/?edition_id=c2be0cf1-f7e4-11e9-9c15-0cc47a0d164b \xe2\x80\xa6 to receive our daily curated #crypto and #blockchain #news.\n\n#bitcoin #btc #ethereum #eth #ripple #xrp #cardano #ada #litecoin #ltc #eos #xlm #trx #dash #iota #xmr,3,0
2019-10-26 19:30:47,From $8600 to $10500 in 24 hours? did anyone see that in TA? #bitcoin #BTC #TA #Technicalanalysis,3,2
2019-10-26 18:04:16,US MUST LEAD ON BITCOIN #bitcoin $BTC #Trump #Crypto #blockchainhttps://twitter.com/APompliano/status/1187924456397824003 \xe2\x80\xa6,2,0
2019-10-26 18:18:13,At least they are not hiding the fact that they are protecting the oil! The US military\xe2\x80\x99s main job is to protect Oil! If you are a Bitcoiner and you don\xe2\x80\x99t know what the petrodollar is need to do some homework this weekend! #PetroDollar #OilWars #Bitcoin #BTC $BTC https://twitter.com/WSJ/status/1188149575762223108 \xe2\x80\xa6,1,0
2019-10-26 20:26:36,"See I\xe2\x80\x99m helping noobs daily! You are welcome! Use my referral links fam! https://linktr.ee/CryptoAdam  coinbase & cash app let you offline your coin! \xe2\x80\x9cNot your keys, not your coins\xe2\x80\x9d #Bitcoin #BTC you are welcome! https://twitter.com/OCDecaf/status/1188177488121384960 \xe2\x80\xa6",1,0
2019-10-26 20:05:36,"Well, this will be an interesting daily close! \n\n#CRYPTO #BITCOIN $BTC",3,0
2019-10-26 21:33:51,I have a good news for you \n\n You can use http://coinlegs.com  for FREE with limited features from now on \n\n#binance #bittrex #cryptocurrencies #cryptotrading #Crypto #bitcoin $BTC $ETH $XRP $TRX $ADA $BNB $XLM $WAVES $LTC $BCHpic.twitter.com/IEIck42tak,2,0
2019-10-26 16:51:46,0x vs. BTC. 0x off -15.60% vs BTC! Time to buy the 0x dip?\n@altcoingazette\n\nhttp://altcoingazette.com \nhttps://coinmarketcap.com/currencies/0x/#charts \xe2\x80\xa6\n$BTC $ETH $XRP $BCH $EOS $XLM $BITCOIN #BTC #bitcoin #cryptocurrencies $bitcoin $tezos $zcash #dai $0x $Zcash $BAT #BAT #halloween2019,1,1
2019-10-26 20:59:12,Panzer Dragoon: Remake Proves Nintendo Switch Has an Exclusivity Crisis\n\nlink: https://www.ccn.com/panzer-dragoon-remake-proves-nintendo-switch-has-an-exclusivity-crisis/ \xe2\x80\xa6\n\n#bitcoin $BTC #BTC #ETH $ETH #CRYPTO #news #USD #TRUMP #GBP #blockchain #ico #techpic.twitter.com/XATZtKVAOT,1,0
2019-10-26 20:04:45,"While Bitcoin experienced a Death Cross, many Altcoins are now approaching a Golden Cross! #BUIDL #HODL #metalpay #mtl #crypto #cryptocurrency #cryptocurrencies #cryptonews #cryptotrading #bitcoin #btc #altcoin #altcoins #blockchain #investing #investment #finance @metalpaysme",2,1
2019-10-26 15:29:44,"The number of #Americans who own #cryptocurrencies has almost doubled in 2019, from 7.95% in 2018 to 14.4%, according to a new survey by Finder. \n\nSource: cointelegraph\n\n#Mobie #MobieX #MobiePay #MobieCoin #MBX #XLM #MobieWallet #crypto #altcoin #bitcoin #btc #blockchain #ethpic.twitter.com/1ZjkNTx7bN",6,1
2019-10-26 17:11:50,"I am thrilled about the upcoming @metalpaysme Metal X crypto exchange, debit cards and direct deposit. #BUIDL #HODL #metalpay #mtl #crypto #cryptocurrency #cryptocurrencies #cryptonews #cryptotrading #bitcoin #btc #altcoin #altcoins #blockchain #investing #investment #finance",4,0
2019-10-26 22:45:38,Did u author the kids book\n\nAbout how the sky is falling\n\n#bitcoin $btc u remind me of those old parents who panic over little things and thinks it\'s the end of the world.,2,0
2019-10-26 22:59:11,5 Elon Musk Lawsuits That Are Almost Too Bizarre to Believe\n\nlink: https://www.ccn.com/5-most-bizarre-legal-battles-involving-tesla-boss-elon-musk/ \xe2\x80\xa6\n\n#bitcoin $BTC #BTC #ETH $ETH #CRYPTO #news #USD #TRUMP #GBP #blockchain #ico #techpic.twitter.com/E74AB9Xlof,1,0
2019-10-26 09:24:06,Bitcoin Bulls Are Back And China Pushes Blockchain Development \xe2\x80\x93 Huge Prediction: BTC To Hit $100 M https://oracletimes.com/bitcoin-bulls-are-back-and-china-pushes-blockchain-development-huge-prediction-btc-to-hit-100-million/ \xe2\x80\xa6 #bitcoin #btc,1,0
2019-10-26 23:37:56,Check out #MesChain.\nIt will make many people rich.\n$Mes\n\nAds have not started yet.\n\nIt\'s traded on @CoinTigerEX \n\n#bitcoin $btc $xrp $hot $bnb $crypto #kripto #trump $Ltc $Bch,5,0
2019-10-26 12:50:05,News of the day\n\nBitcoin Is Back With 36% Gains\n\nhttps://coinscapture.com/trending/s9sRr9Z9pH \xe2\x80\xa6\n\n#news #bitcoin #BTC #bitcoinnews #saturdaymotivation #weekend #bitcointrading #SaturdayThoughts #CryptoNews #Blockchain #gains #price #SaturdayMorning #follo4follo #follovback #Retwet #like #instagood #likepic.twitter.com/z2FnUnsWM4,5,1
2019-10-26 22:31:53,The virus is speading!  #bitcoin $BTC https://twitter.com/MarkYusko/status/1188220264942841856 \xe2\x80\xa6,2,0
2019-10-26 23:04:08,Curious to see what happens to Bitcoin when China wakes up. $BTC #Bitcoin #BTC $BTC.X #BTCUSD,4,0
2019-10-26 14:09:41, Whoa \n First Order Miner Outlook Flex Fit Hat \n Get it here  https://tinyurl.com/y5m77wl7  \n#Bitcoin $BTC #BTC #Crypto #cryptocurrency #ETH #XRP #LTC #XVG #DGBpic.twitter.com/xJel7m6ypS,1,0
2019-10-26 21:04:03,Where we\xe2\x80\x99re going we don\xe2\x80\x99t need a sell button #bitcoin $BTC $GBTC \n\n@BitwiseInvest @HHorsleyhttps://twitter.com/jack/status/1187924295084838917 \xe2\x80\xa6,10,2
2019-10-26 22:34:19,"#Cryptocurrency sponsored competitive driver, Scott Dinin, is in the running for Rookie of the Year.\n\nBest of luck to you @ScottyD_95 \n#Circuit #CRCT #Bitcoin #BTC https://twitter.com/CircuitSociety/status/1188160879285690368 \xe2\x80\xa6",12,6
2019-10-26 12:54:23,PodMiners is a blockchain based platform where you can live stream and broadcast the pre-recorded shows.\n#POMT #PODMINERS #ICO #bitcoin #btc #cryptocurrency\n@PodMiners,0,0
2019-10-26 20:52:19,Username : BRIGEZIYAN\n\nwish me luck \n\n#SwcPoker #Giveaway #Poker\n#OnlinePoker\n#PlayPoker\n#TexasHoldem\n#PokerPro\n#CryptoGames \n#Crypto #Bitcoin $BTC\n#MyFavoriteSite,2,0
2019-10-26 22:10:05,"Bitcoin BTC Current Price:\n$9,223.17\n1 Hour: 1.28 % | 24 Hours: 6.86 % | 7 Days: 15.30 %\n#btc #bitcoin",1,0
2019-10-26 23:24:33,Test your Apollo Currency knowledge in less than 10 words. \n@ApoIloCurrency #blockchain #crypto #cryptocurrency #cryptocurrencies #bitcoin #Altcoins #apl #btc #trx #xrp @josephbartosie1 @Dr_Don_Chepe @Djesfrey @sultan_kassam @76Shadabkhan @ilove_apollo @ApolloNigeria @endoman333pic.twitter.com/bHcFwMmcCY,19,11
2019-10-26 16:50:19,We are tired to see the correlation between alts and #bitcoin #BTC $BTC\nThis should end someday.\nWe want the freedom of alts,14,0
2019-10-26 22:00:45,Play Royal also has its own integrated payment processor Carbon Money http://ow.ly/9lQo30pKzGm \n\n@PlayRoyal_EN @CryptoAlliance3 @FIO_Social #bitcoin #BTC #ethereum #TRX #USDT #EXCHANGE #Crypto #cryptocurrency pic.twitter.com/WCmCGAqRA2,4,4
2019-10-26 13:53:32,Three Reasons Why Bitcoin (BTC) Price Surged 40 Percent #bitcoin #btc #cryptocurrency #rockethttps://cryptohero8.com/three-reasons-why-bitcoin-btc-price-surged-40-percent/ \xe2\x80\xa6,0,0
2019-10-26 12:23:31,BITCOIN!!! #BTC #bitcoin,0,0
2019-10-26 15:50:06,Bet by bitcoin at http://bit.ly/cI0udBet \n5 BTC bonus!\n\n#bitcoin #btc #bet #soccer #betting #basketball #tennis #nba #epl #bundesliga #SerieA #League1 #Superligpic.twitter.com/SecQle6RS8,0,0
2019-10-26 18:10:00,It\xe2\x80\x99s called Stoned Ape theory! Magic mushrooms are actually higher intelligence alien life forms! Just saying! Isn\xe2\x80\x99t that right @joerogan ?! #StonedApeTheory #Bitcoin $BTC https://twitter.com/APompliano/status/1188148620140404737 \xe2\x80\xa6,1,1
2019-10-26 23:42:49,"1 Bitcoin ( #BTC )\nDollar: 9257.24$ \n\n1 Bitcoin Cash ( #BCH )\nDollar: 2,54.60$ \n\n1 Ethereum ( #ETH )\nDollar: 180.34$ \n\n1 Ripple ( #XRP )\nDollar: 0.29425$ \n\nDate: 26 Oct 2019 23:42\n\n#Bitcoin #Ethereum #cryptocurrency #crypto #altcoin #Blockchain #Ripple",0,0
2019-10-26 23:00:01,"Bitcoin - BTC\nPrice: $9,167.03\nChange in 1h: -0.39%\nMarket cap: $165,142,211,632.00\nRanking: 1\n#Bitcoin #BTC",0,0
2019-10-26 22:34:20,TAXATION IS THEFT!\nRepost  @wokebreed \nFollow  @satoshianalysis \n#craigwright #craigswright #bitcoinmining #bitcoin #btc #bitcoinprice #satoshivision #satoshi #cryptocurrency #crypto #metanet #bchsv #satoshisvision #sv #ethereum #cryptomemes #cryptonews #cryptos #rekt #cr\xe2\x80\xa6,0,1
2019-10-26 21:42:49,"1 Bitcoin ( #BTC )\nDollar: 9196.00$ \n\n1 Bitcoin Cash ( #BCH )\nDollar: 2,51.52$ \n\n1 Ethereum ( #ETH )\nDollar: 178.93$ \n\n1 Ripple ( #XRP )\nDollar: 0.29221$ \n\nDate: 26 Oct 2019 21:42\n\n#Bitcoin #Ethereum #cryptocurrency #crypto #altcoin #Blockchain #Ripple",0,0
2019-10-26 21:00:02,"Tomorrow\'s Bitcoin(BTC) forecast is\n        \n\xe2\x96\xb3UP 100% \n\xe2\x96\xbcDOWN 0%\n\n#Bitcoin, #BTC\n\nBitcoin Forecast (iOS)\nhttps://itunes.apple.com/app/id1404198250 \xe2\x80\xa6pic.twitter.com/dOGXWwgmhT",0,0
2019-10-26 20:40:47,Bitcoin doesn\'t gain because China \n\nChina gains because #Bitcoin\n$BTC @TokenHashhttps://twitter.com/cz_binance/status/1188138541001236480 \xe2\x80\xa6,4,1
2019-10-26 20:25:04,Whoever put this up deserves a medal\n\n http://ElixiumCrypto.com/06/  \n\nCrypto Derivatives with the Best Perpetual Contracts \n\n#Crypto #Cryptocurrency #Bitcoin #BTC #Ethereum #ETH #Ripple #XRP #EOS #Stellar #Litecoin #LTC #Cardano #Monero #TRON #IOTA #Dash #Tezospic.twitter.com/uw8UeT034P,0,0
2019-10-26 20:22:06,"Bears u better run\nU better close what u can\nI dont want 2 see ur blood\njust cut ur losses man\nU want 2 be tough\nbut shortings really rough\nJust Beat it!\nIf u short,u will be defeated!\nShowin ur TA,with Bearish fright\nIt doesnt matter,Ur wrong,Im right\nSo Beat it! #bitcoin #btc pic.twitter.com/tIgGyMPirU",6,1
2019-10-26 20:19:51,"Potential macro bull flag setup on Bitcoin daily chart\n\nIf this plays out, strap in \xe2\x80\x94 we may see an #ATH by EOY  \n\n#bitcoin #btc #cryptocurrency #crypto #moondreams #ether #xrp #fintech #altcoins #moon #digitalassets #cryptotrading #bitcoinnews #ethereum #forzacryptopic.twitter.com/BdCSeG7WnN",1,1
2019-10-26 20:12:58,Analyst Tom Lee Says Golden Rule for Bitcoin\xe2\x80\x99s Gains at Play As BTC Swings https://dailyhodl.com/2019/10/26/analyst-tom-lee-says-golden-rule-for-bitcoins-gains-at-play-as-btc-swings/ \xe2\x80\xa6 #Bitcoin $BTC #BTC @fundstratpic.twitter.com/au4BkICnya,0,0
2019-10-26 20:05:24,"If you are speculating that China, a communist power hungry nation, will embrace #Bitcoin $BTC, then you are simply wrong. It will most likely create its own #cryptocurrency to control its people further, similar to #Ripple $XRP (a permissioned #blockchain). This is bad news!https://twitter.com/AltcoinSara/status/1188182097514680321 \xe2\x80\xa6",15,1
2019-10-26 19:53:19,"#Bitcoin #bitcoin \n$BTC $Btc $btc \n@PaweeelekMlody \n\n@100trillionUSD \n\nThe model predicts a bitcoin market value of $1trn after next halving in May 2020, which translates in a bitcoin price of $55,000\n\n pic.twitter.com/OI1itJftwm",3,2
2019-10-26 18:34:51,"#BitCoin #BTC Still Respecting The Support & Resistance Key Points Of The Weekly Candles (Great Support $7300 & Great Resistance $10300). wanna Bet On Bitcoin? Put Your Orders At Those Points, Set & Forget.\n\nhttps://www.tradingview.com/chart/BTCUSDT/LpafVBMM-Weekly-Bitcoin-BTC-USDT-Analysis-June-23-201-10-55-PM-My-Time/ \xe2\x80\xa6",2,0
2019-10-26 17:11:25,"#bitcoin #BTC\nBITCOIN IS BREAKING BACK INTO 5-FIGURE TERRITORY AGAIN! Dollar Cost Averaging was never such an obvious strategy for maximizing gains in a simple, straightforward manner. pic.twitter.com/xXmEHywgo8",0,0
2019-10-26 16:57:27,"Investment plan\n\nInterBit Investment Ltd offers you several investment plans, starting with a minimum investment of 1000 euros ... the equivalent in bitcoin\nhttps://interbit-investment.com/ \n#btc #bitcoin #btcnews #bitcointrading \n#bitcoins #BTC #cryptocurrency $btc @InterbitI",0,1
2019-10-26 16:09:04,"Don\'t be retarded. EVERYONE other than you and Craig know that #Bitcoin is $BTC. genesis block 2009 till 2017 when BSV forked off of an altcoin forked airdrop $BCH. $BSV is an alt coin, PERIOD. Created WAY after the real bitcoin $BTC. Sorry you weren\'t around, stop with the FUD",0,0
2019-10-26 14:35:08,This is how it all started\n\n#Bitcoin #BTC\n$BTCUSD\n\nNot financial advice\n#Trading #Crypto involves risk pic.twitter.com/0IQ0eMV61p,1,1
2019-10-26 14:10:28,RT @CoinCapsAi: #anonymous #bitcoin #prophecy goes #viral as #btc #leads #crypto #resurgence \n#instaairdrop #bitcoin #btc #xrp #coinbase #fintech #trading $ETH $LTC $EUR $ETC #money\nhttp://bit.ly/341entp ,0,0
2019-10-26 13:36:22,Life hack: Do not short Bitcoin! I wonder how many shorts got their account liquidated!? \n#Bitcoin #BTC #LTC,0,1
2019-10-26 13:19:23,"How to do #Crypto right \n\xe2\x80\x9cRather than propose a new digital currency as the savior of the financial system, Square has embraced what already exists: bitcoin.\xe2\x80\x9d\n$BTC #Bitcoin #Blockchain #Decentralized #DigitalAssets #DigitalEconomy #Wawasan2035 #BruneiCrypto #FetchProhttps://twitter.com/jack/status/1187832235405336576 \xe2\x80\xa6",2,2
2019-10-26 11:27:19,To celebrate @ElectracoinECA being listed on FUDX we have 40K $ECA up for grabs\n\nTo take part simply:\n\n\xe2\x80\xa2Follow @FUDXcom\n\xe2\x80\xa2Tag 3 friends & Retweet.\n\xe2\x80\xa2Sign up to the http://fudx.com  newsletter.\n\n#cryptocurrency #giveaways #blockchain #bitcoin #LTC #BTC #crypto pic.twitter.com/tVOedze7jX,77,71
2019-10-26 11:00:55,"#Pi\'s ""growing popularity is a result of the network\xe2\x80\x99s relative \xe2\x80\x9caccessibility.\xe2\x80\x9d - Vince, @PiCoreTeam \n\n#Pi1Million #Cryptocurrency #Crypto #Bitcoin #BTC #XRP #ETH #PiCryptoNetwork #PiCryptoNetworkDotCompic.twitter.com/ReKs9RRHPh",13,5
2019-10-26 11:00:03,"Tomorrow\'s Bitcoin(BTC) forecast is\n        \n\xe2\x96\xb3UP 68% \n\xe2\x96\xbcDOWN 32%\n\n#Bitcoin, #BTC\n\nBitcoin Forecast (iOS)\nhttps://itunes.apple.com/app/id1404198250 \xe2\x80\xa6pic.twitter.com/Fq9IC5kZuO",0,0
2019-10-26 10:39:23,What a great day for #Bitball\n\nListing is confirmed for #BTB on @TradeSatoshi #cryptocurrency #exchange in the following pairs\n#Bitcoin #BTC \n#Ethereum #ETH\n#Dogecoin #doge\n#Tether #usdt\nFollow our social media for more updates.\n\n#Crypto #listing #tradesatoshi #token #coinpic.twitter.com/XJ2km6KZUA,65,46
2019-10-26 10:37:09,Told ya! \n\n$BTC is back on top Now the coin is trading above $9200 mark.\n\n#bitcoin #BTC #cryptomarkethttps://twitter.com/Changelly_team/status/1187387689961775104 \xe2\x80\xa6,23,2
2019-10-26 10:23:25,Bitcoin is no stranger to strong retraces a few months prior to its respective Halving\n\nThese retraces also happen to be the first major corrections in a new Bitcoin Bull Market\n\nBitcoin has retraced 47% again\n\nhttps://youtu.be/Tc8ycsY4-kw \n\n$BTC #Bitcoin #Crypto pic.twitter.com/FBLt1pvam7,102,27
2019-10-26 09:50:17,Bitcoin Bull Market Progress:\n\n\xe2\x96\x93\xe2\x96\x93\xe2\x96\x91\xe2\x96\x91\xe2\x96\x91\xe2\x96\x91\xe2\x96\x91\xe2\x96\x91\xe2\x96\x91\xe2\x96\x91\xe2\x96\x91\xe2\x96\x91\xe2\x96\x91\xe2\x96\x91\xe2\x96\x91 19.1%\n\n$BTC #Bitcoin #Crypto,137,23
2019-10-26 09:26:03,"Bitcoin flash crashes to below $9,200 \n\nIs it time to sell?!\n\n#Bitcoin $BTC pic.twitter.com/WSbKMqtdBu",81,4
2019-10-26 09:16:27,"MAKE MONEY WHEN TEAMS WIN, TIE, LOSE WITHOUT EVER PLACING A BET ENTER YOUR DETAILS BELOW TO LEARN MORE. https://sportstradingbtc.com/optin4?id=neit \n#sportsbetting #sportstrading #gambling #bitcoin #btc #gamblingtwitter #betting #bet #crypto #cryptocurrency pic.twitter.com/XWXHA43B1j",5,5
2019-10-26 08:59:04,I predicted $ADA to be ~$6-$20 in the long run and provided some reasoning. In the latest AMA Charles told that #Cardano could be the first one trillion project. The top ten project for the masses will be valuable.\n\nhttps://medium.com/@CardaniansI/how-far-the-price-of-cardanos-ada-might-go-97e91a5ea75 \xe2\x80\xa6\n\n#blockchain #crypto #bitcoin $btc $eth,154,43
2019-10-26 08:38:03,State media and voice of the Chinese Communist Party @PDChina also pays attention to president Xi\'s comments about blockchain as an important breakthrough for independent innovation of core technologies #satoxi #bitcoin #btc #chinapic.twitter.com/WFT2AAaV2D,15,5
2019-10-26 07:51:33,"#bitcoin - $BTC\n\nEuphoria and dead bears aside \n\nBulls are not officially out of the woods yet, as price is still below a key bullish support - now resistance.\n\nVITAL TO FLIP THAT LEVEL \n\nTo bury bears forever, you want to see price where there are those blue random arrows pic.twitter.com/lD0mzJCHAh",35,7
2019-10-26 07:41:47,"#BTCUSD Trading doesn\'t just reveal your character, it also builds it if you stay in the game long enough. $crypto Twitter + greed + fear is the obstacle you must encounter. \n#Joker #TradeDifferent #bitcoin $BTC #btc https://twitter.com/KiaCrypto/status/1181207743912394752 \xe2\x80\xa6",28,5
2019-10-26 07:37:05,"Bitcoin Price Back Over $10K Following 36% Gains on the Day\n\nBitcoin (BTC) is back above $10,000 for the first time since Sept. 22 after seeing massive gains of 36% on the day\n\nCheck The Whole Article- http://bit.ly/2NrfbkL \n\n#Burency #bitcoin #price #tenthousand #dollars #btc",65,39
2019-10-26 07:36:12,"$BTC #BITCOIN\n\n 100-Week MA test completed and held, similar to beginning 2016.\n Back above 200-Day MA & EMA, important indicators.\n Holding trendline as well.\n\n2016 period and now are still comparable in which targeting $17,000-20,000 prior to halving is realistic. pic.twitter.com/TPrQwJFxBX",163,63
2019-10-26 07:21:33,Someone had to do it.\n\n#Bitcoin $BTC pic.twitter.com/Lh8cxnXd2J,39,5
2019-10-26 07:19:56,We believe in #Cardano and have a few good reasons for that. What are your reasons?\n\nRead our article:\nhttps://medium.com/@CardaniansI/why-i-believe-in-cardano-a2a86c449d45 \xe2\x80\xa6\n\n#blockchain #bitcoin #crypto $btc $ada $eth $eos $xrp $bnb $ltc $trx $xmr,100,18
2019-10-26 06:33:56,Did we teleport past the Vegeta memes? #Bitcoin $BTC,215,38
2019-10-26 04:46:19,"50,000 $CRCT #CRYPTOCURRENCY #GIVEAWAY\n\nCheck out @SpectreAdachi promotion below! \n\nEnter for a chance to win #Free #CRCT and be placed on a PRIORITY listing to receive Circuit updates\n\nCircuit #Newsletter Link\nhttps://mailchi.mp/e44f61da6793/officialcircuitnewsletter \xe2\x80\xa6\n#Bitcoin #BTC #Crypto #Racinghttps://twitter.com/SpectreAdachi/status/1186430637500178432 \xe2\x80\xa6",14,9
2019-10-26 02:05:17,40 followers to go and it\xe2\x80\x99s #Ledger nano X giveaway time!!\n\n#Crypto #cryptocurrencies #bitcoin #BTC #ETH #ETHEREUM #cryptotwitterhttps://twitter.com/eternalcrypto1/status/1187858587239870464 \xe2\x80\xa6,236,117
2019-10-26 01:59:15,http://PlayRoyal.com  News and Updates on @Tronix #reddit Forum\n\nhttps://www.reddit.com/r/Tronix/comments/dn7ga2/play_royal_updates_and_news/ \xe2\x80\xa6\n\nhttp://ow.ly/ejof30pKzGl  \n@PlayRoyal_EN\n@CryptoAlliance3\n@FIO_Social\n#bitcoin #BTC #ethereum #TRX #USDT #EXCHANGE #Crypto #cryptocurrency #news pic.twitter.com/aZPzGClKBV,6,5
