date,text,likes,retweets
2019-07-21 04:02:08,"Wait! What?... Did She Just Say ""BITCOMMMM!"" \n\n""BlockChain Stand Up Comedy Nite Guys!""\n\n#bitcoin #crypto #cryptocurrency #CryptoNews #btc #ltcpic.twitter.com/7PBa3qTC9p",117,23
2019-07-21 22:15:59,Coinbase Shoots for the Moon: Aims to Scale Digital Currency Economy Beyond Crypto Trading\n\n#Bitcoin #BTC $BTC #Crypto #Ecosystemhttps://dailyhodl.com/2019/07/21/coinbase-shoots-for-the-moon-aims-to-scale-digital-currency-economy-beyond-crypto-trading/ \xe2\x80\xa6,14,10
2019-07-21 12:09:47,"Around 21k .zil domain registered in a short time via @unstoppableweb on #zilliqa platform.\n\nNetwork is growing, be a part of future. Build or invest!\n\n#bitcoin #btc #blockchain #cryptocurrency #crypto #ethereum\n\nhttps://viewblock.io/zilliqa/address/zil15yw7wej02h6mm7z5f2dvwytfr5qn0z6vlwqug6 \xe2\x80\xa6",32,12
2019-07-21 21:28:09,"Join #Exor and get a chance to win 10,000 Exor Coins #giveaway - Follow + Retweet + join Telegram channel https://t.me/ExorOfficialSupport \xe2\x80\xa6 winner will be announced on August 15th #cryptocurrency #cryptocurrencynews #Crypto #bitcoin #bitcoin #ETH #Litecoin #invest #forextrading #BTC pic.twitter.com/GbiJIRlorJ",102,105
2019-07-21 20:01:40,My name is Johnny Bitcohen ... billionaire living in Asia | I trade tens of mlns of $$ in #bitcoin $BTC daily. I amuse myself watching you all jump off a cliff every time I trigger red candles & by watching you trip over yourselves trying to get back in when I trigger green ones. pic.twitter.com/qJeVyFYkbv,20,5
2019-07-21 15:10:14,"#XRP #XRPcommunity #btc #bitcoin according to bitcoiners banks won\xe2\x80\x99t be using XRP, no not at all  bunch of jokers https://twitter.com/Dillon/status/1152698636901507073 \xe2\x80\xa6",77,19
2019-07-21 17:31:15,Donald Trump Just Made Bitcoin A 2020 Election Issue http://bit.ly/2lCpGHy  #bitcoin #blockchain #btc #crypto #money #altcoins #altcoin #bitcoinnews #cryptocurrency #cryptonews #cryptopricepic.twitter.com/vooyMqbG1S,4,2
2019-07-21 19:07:33,"https://www.trustnodes.com/2019/07/19/countdown-to-bakkt-bitcoin-monday-launch-begins-ethereum-next \xe2\x80\xa6\n\nThis one is a real big deal.  Why aren\'t you in Bitcoin, Ethereum yet ?  Let the FOMO ensure.  #bitcoin $btc",4,2
2019-07-21 13:23:45,"Bitcoin (BTC) To Surge To $14,000 In The Short Term Soon https://oracletimes.com/bitcoin-btc-to-surge-to-14000-in-the-short-term-soon/ \xe2\x80\xa6 #bitcoin #btc #ToneVays",0,0
2019-07-21 16:00:47,USDTRY Harmonik BAT Formasyon - #USDTRY TradingView https://tr.tradingview.com/chart/USDTRY/DinNYBhP/ \xe2\x80\xa6\n\n#USDTRY #Forex #ForexTrading #ForexSignals #Trading #HarmonicPattern #usdtry #eurtry #Bitcoin #BTC #BTCUSD #Kripto #Ethereum #Crypto #cryptocurrency,33,5
2019-07-21 19:19:49,"$BTC #BItcoin 4 hour - BB\'s tightening, $BTC working on a tweezer at lower band pic.twitter.com/L3IP00lQoH",33,3
2019-07-21 22:17:33,"BlockSafe Technologies has created a defender that protects the exchange\xe2\x80\x99s computers and mobile devices from keylogging, screen capture, and clickjacking attacks.\nhttps://blocksafetech.io/  #BlockSafe #BSAFE #STO #bitcoin #btc #cryptocurrency",3,0
2019-07-21 16:28:38,#Blockchain For Everyone.\n\nComing August 6.\n\n---\n@simonschuster @GalleryBooks \n@RobMontepeluso @rogerkver @TimDraper @APompliano @HJohnhenry @ScandalOfMoney @ForbesCrypto @BlockchainGirls #bitcoin #BitcoinCash #btc #Ripple pic.twitter.com/CirZ88e9K1,7,4
2019-07-21 21:17:23,"Everybody is waiting for #Binance #Alts to pop.. \n\nMeanwhile, #ECA went a 100% this week in all silence.. \n\n24th of July a huge partner will be announced. Be quick and hop in.. \n\n#ElectraCoin #Bitcoin #Btc #CryptocurrencyNews #AltCoins $ECA $BTC $ETHpic.twitter.com/1nhUHHh8wv",89,38
2019-07-21 20:27:36,Bank of America Files Patent for Settlement System Citing Ripple #xrp #ripple #bitcoin #btc #crypto https://cointelegraph.com/news/bank-of-america-files-patent-for-settlement-system-citing-ripple \xe2\x80\xa6,1,2
2019-07-21 15:55:06,"A security mechanism implemented on the Lightning Network confiscated approximately 2.22 (~$21,600) #Bitcoin ($BTC) from misbehaving nodes on the network.\nhttps://beincrypto.com/lightning-network-security-mechanism-working-as-intended-claims-bitmex-report/ \xe2\x80\xa6",3,2
2019-07-21 22:53:27,The Inverse Head & Shoulder hasn\'t really played out as many expected  it to in the past few days as we witness a retracement around the 11.1k mark due to the low volume.\n\nThe bulls seems to not to back down as the hold a support at 10.3k forming a new trend.\n\n#bitcoin $btc pic.twitter.com/ggDZJUAG2W,2,1
2019-07-21 16:02:32,It\'s not all bad news for Bitcoin! \n\nHere\'s why... https://invst.ly/bcqmd \n\n#Bitcoin #Crypto #BTC #Trump #Mnuchin @ClemThibaultpic.twitter.com/7sI4WOHzFN,13,3
2019-07-21 23:54:00,Cartels laundering their proceeds of crime through the use of gold bars. Perhaps someone should forward on to Steve Mnuchin so that they can look to banning gold  \n\nhttps://www.foxnews.com/travel/police-5-million-gold-bars-heathrow-airport \xe2\x80\xa6 #Gold #bitcoin $BTC #crypto #cartels #MoneyLaundering #dollars #blockchain,3,0
2019-07-21 13:55:34,The Silverlink Network is now on InvestFuture-Russian Version:  https://bit.ly/2Y68RSE \n#crypto #cryptocurrency #blockchain #bitcoin #BTC #ethereum #ETH #ALTcoins #SmartContracts #token #tokens #coins #ICO #OTC #IEO #STO #tokensale #crowdsale #presale #preICO #mainsale\n#russia,2,0
2019-07-21 16:54:12,USDCHF Harmonik BAT ve GARTLEY Formasyon - #USDCHF TradingView https://tr.tradingview.com/chart/USDCHF/LWfnnV5m/ \xe2\x80\xa6\n\n#USDCHF #Forex #ForexTrading #ForexSignals #Trading #HarmonicPattern #usdtry #eurtry #Bitcoin #BTC #BTCUSD #Kripto #Ethereum #Crypto #cryptocurrency,18,2
2019-07-21 13:00:53,#Bitcoin $BTC BULLFLAG! Breakout next Week?\nhttps://www.youtube.com/watch?v=PBGTLwUy_UI&t= \xe2\x80\xa6,25,0
2019-07-21 17:27:54,$WXT $USDT on @kucoincom with Clara and Clarisse  @kryll_io automatic trading bot #Bitcoin $BTC https://platform.kryll.io/r/5c68664fa727671b94a4db8f \xe2\x80\xa6pic.twitter.com/1y8aQERgkA,7,2
2019-07-21 16:05:09,"The courts in China have determined #Bitcoin ($BTC) to be a virtual property due to it being \xe2\x80\x9cvaluable, scarce, and disposable.\xe2\x80\x9d\nhttps://beincrypto.com/bitcoin-is-now-seen-as-virtual-property-under-chinese-law/ \xe2\x80\xa6",2,2
2019-07-21 20:29:14,Bitcoin: The Battle Rages On https://mentormarket.io/cryptocurrencies/workin2005/bitcoin-the-battle-rages-on/ \xe2\x80\xa6 #bitcoin #btc #bitcoinnews,4,1
2019-07-21 16:45:40,Nailed it  \nShort from 11k\n#bitcoin $btc https://twitter.com/TheCryptoLotus/status/1152629266636509190 \xe2\x80\xa6,6,0
2019-07-21 18:52:37,Bakkt Set to Commence User Testing For Bitcoin Futures on July 22 - http://bit.ly/2Yh0lVe \n #bitcoin #btc #bitcoinnews #blockchainpic.twitter.com/fNgt5ZxEdc,8,4
2019-07-21 18:03:53,"To add more on the bull run:\n> $10935 is minimum requirement. That means, trend gets neutral.\n> $12320 makes the trend positive\n> breaking above the Orange channel makes it bullish\n\nEveryone has different risk tolerance, you may enter as suits you.\n\n$BTC #Bitcoin #BTC #Crypto",4,0
2019-07-21 18:31:07,Thumbs up for @mr_kristof007! His crypto related vids are very recommended: https://m.youtube.com/user/kristoffer1223 \xe2\x80\xa6 $chz #bitcoin #btc,3,0
2019-07-21 19:05:42,Not bad trading good in @bikiexchange .. Got 1st Spot #ATF #Trading #exchange #cryptoexchange #bitcoin #btc #cryptocurrency pic.twitter.com/t73DYUnEgo,2,1
2019-07-21 22:43:45,We made our 1st order for the week. Sold 4 pairs of Bitcoin socks. #cryptotwitter #cryptocurrency #bitcoin #BTC #cryptosocks #blackcryptotwitterpic.twitter.com/asuQY7ddDh,6,0
2019-07-21 23:59:39,Do you remember when you joined Twitter? I do! Beep. Boop. #MyTwitterAnniversary $btc #bitcoin #btc #vsky #pricebot #bitcoinpricepic.twitter.com/iGTYpdW2yX,3,1
2019-07-21 18:42:03,Two best strageties for accumulating during a bullmarket\n\n1. Dollar cost averaging \n2. Buying major dips of 20-40% from recent highs \n\nWe are in a bull market and will be until December 2021 \n\nPlan accordingly \n#ltc #litecoin #bitcoin #btc,25,6
2019-07-21 21:20:28,"1 Bitcoin ( #BTC )\nDollar: 10,572.78$ \n\n1 Bitcoin Cash ( #BCH )\nDollar: 3,19.42$ \n\n1 Ethereum ( #ETH )\nDollar: 224.77$ \n\n1 Ripple ( #XRP )\nDollar: 0.32994$ \n\nDate: 21 Jul 2019 21:20\n\n#Bitcoin #Ethereum #cryptocurrency #crypto #altcoin #Blockchain #Ripple",2,0
2019-07-21 17:25:20,Bitcoin (BTC) was started by an unknown person or group by the name of Satoshi Nakamoto in 2008 and now a well-known coin. http://bit.ly/2ANJD2R \n\n#HyperionInvests #IHFInvestments #BeLiquid #BTC #cryptotrading #Wemarkpic.twitter.com/wGmbas8qli,2,2
2019-07-21 15:32:11,"@BlockSafeTech Very interesting and promising project. The concept and the system of #BlockSafe are very good. The security of investments is very reliable. Do not miss the new trend in the development of the cryptocurrency, join here.\n#BSAFE #STO #bitcoin #btc #cryptocurrency",4,3
2019-07-21 22:27:05,"Trade Idea of the Week - being released Monday premarket. It will be a swing trade with a very good looking daily chart (room to run).\n\nYou will get entry, exit & target price points \n#stocks #crypto #bitcoin #btc #CryptoNews #StocksToTrade $SPY\n\nFREE at http://bit.ly/2N2Hqca pic.twitter.com/ZoYWeMQS7k",3,1
2019-07-21 22:00:03,Free Earn Bitcoin $ Free Bitcoin Cloud Mining 2019 $ Signup Bonus 200 Gh/s #bitcoin #btc #crypto #cryptocurrency #news #blockchain #altcoin #dailytubehttps://www.dailytube.me/video/fbgYzVn_e-0 \xe2\x80\xa6,1,0
2019-07-21 23:37:01,The cover of the Economist magazine back in 1988. Was this prophetic? Are we witnessing the introduction of a Global currency at some point?\n\n#bitcoin $BTC #crypto #blockchain #trading #exchange #cryptocurrency #token #cryptonews #economist #fiatpic.twitter.com/wp8c2SYhcs,1,0
2019-07-21 22:04:27,How To Invest In Bitcoin? https://www.reddit.com/r/Bitcoin/comments/cg3qjl/how_to_invest_in_bitcoin/ \xe2\x80\xa6 #btc #bitcoin pic.twitter.com/FeBK5CZynm,0,0
2019-07-21 22:00:02,"Bitcoin - BTC\nPrice: $10,582.32\nChange in 1h: +0.7%\nMarket cap: $188,687,081,562.00\nRanking: 1\n#Bitcoin #BTC",1,0
2019-07-21 21:01:58,"Behind Prime Digital Investments are two proud Yoruba & Igbo men from the great country, Nigeria. Not all Nigerians are fraudsters. We smile, we love, we live, we educate! #Nigeria #men #bitcoin $BTC $altspic.twitter.com/LscKvPpJaO",6,1
2019-07-21 21:00:02,"Tomorrow\'s Bitcoin(BTC) forecast is\n        \n\xe2\x96\xb3UP 86% \n\xe2\x96\xbcDOWN 14%\n\n#Bitcoin, #BTC\n\nBitcoin Forecast (iOS)\nhttps://itunes.apple.com/app/id1404198250 \xe2\x80\xa6pic.twitter.com/z5J7ZfSVdc",0,0
2019-07-21 20:53:28,Zip-a-dee doo-dah\nZip-a-dee-yay!\nThis Chart is still Bullish\nSo have a wonderful day!\nZip-a-dee-doo-dah\nZip-a-dee-yay!\nFuck all you TAs\nThis is only going one way\n#bitcoin #btc #ct @CustCarptry @WildchildSings @LlisahMarieGal @GemCrypto @_theperfesser @IICryptoLover #crypto pic.twitter.com/0gjQPJPU8n,11,2
2019-07-21 19:30:10,#Consortiums are intended to be used mostly in the #banking industry and its related industry sectors.\n\nhttps://buff.ly/2JT3MIn \n\n#crypto #cryptocurrency #cryptocurrencies #blockchain #altcoin #altcoins #bitcoin #BTC #ethereum #eth #blockchaintechnology #altcoinmagazine #moneypic.twitter.com/wndEc0Y18p,1,0
2019-07-21 19:28:48,Lowest SAT coins listed on @binance\n\n$NPXS: $0.000599 USD\n$DENT: $0.000747 USD\n$BTT: $0.000998 USD\n$HOT: $0.001279 USD\n\n#NPXS #DENT #BTT #HOT\n#bitcoin #btc $btc #eth $eth\n$xrp $bch $zec $xlm $zrx\n$neo #xrp $gvt $ada $trx\n$ltc $bnb $go $nano $eos\n$xmr $link $bat #altseasonpic.twitter.com/yBBpshHjSg,4,0
2019-07-21 19:13:57,"Strong Password Generator This creates strong passwords based on user-defined preferences, and then stores them in the Password Vault for\nfuture usage.\n\n#BlockSafe #BSAFE #STO #bitcoin #btc #cryptocurrency",2,0
2019-07-21 18:59:36,"It\'s wonderful to see @trylolli ads on @facebook. \n\nWe can (& should) discuss Libra, privacy etc., but FB is 1 of the world\'s largest media companies and Lolli puts #Bitcoin/#BTC front & center for hundreds of millions of people.\n\nThanks @robleathern @beller for your role in thispic.twitter.com/8F8tueTiZA",20,2
2019-07-21 18:03:29,"\xe2\x80\x98Critical Mass\xe2\x80\x99 of Institutional Investors Set to Join Bakkt This Quarter, Reports Wall Street Firm\n\n#Bitcoin #BTC $BTC #Crypto https://dailyhodl.com/2019/07/21/bitcoin-bombshell-critical-mass-of-institutional-investors-set-to-join-bakkt-this-quarter-reports-wall-street-firm/ \xe2\x80\xa6",6,2
2019-07-21 17:34:39,"\xe2\x80\x9cBe a Bitcoin amateur \xe2\x80\x9c \n\nAn amateur, from French amateur ""lover of"" \n\nThe amateur was considered to be the ideal balance between pure intent, open mind and the interest or passion for a subject. \n\n#bitcoin #btc #amateur",3,0
2019-07-21 16:51:28,"#PersonalWager,#PWON, #PlayerWonCoin, #bitcoin, #btc #cryptocurrency The PlayerWonCoin (\xe2\x80\x9cPWON\xe2\x80\x9d) solution solves all of the aforementioned problems and\nlimitations by creating a very simple \xe2\x80\x9cutility coin\xe2\x80\x9d which acts as a stored value for players\ntransactions.",2,0
2019-07-21 16:36:57,EURNZD Harmonik BAT Formasyon - #EURNZD TradingView https://tr.tradingview.com/chart/EURNZD/iCGci6li/ \xe2\x80\xa6\n\n#EURNZD #Forex #ForexTrading #ForexSignals #Trading #HarmonicPattern #usdtry #eurtry #Bitcoin #BTC #BTCUSD #Kripto #Ethereum #Crypto #cryptocurrency,21,2
2019-07-21 16:31:33,"Time is running out to buy cheap $TEL! @telcoin_team have been making major moves. This baby has been destined to fly for a very long time! With so much in store for this project, the skies the limit for this diamond in the rough! \n\n#telcoin #telfam #tel #crypto #bitcoin $btc https://twitter.com/paddystash/status/1152975769389404161 \xe2\x80\xa6",25,2
2019-07-21 15:50:06,Waiting for a snarky maximalist to replace \'Lion King\' in this tweet with BTC.\n#bitcoin #btc $btc https://twitter.com/winklevoss/status/1152943040891408386 \xe2\x80\xa6,0,0
2019-07-21 15:19:54,"Bitcoin has formed a bull flag and is oversold on the 30m. Re-enter now in the $10,300 or a little lower. Bears will try to pull it down one more time to $10,100\'s area before a pump. Would not be surprised if it goes to $11,400.\n\n#bitcoin #btc #litecoin #crypto #cryptocurrency pic.twitter.com/KAIxxEzxJk",3,0
2019-07-21 14:55:34,But when will @neorsd start accepting Bitcoin?? $btc #bitcoin #flushfiat,1,0
2019-07-21 14:15:04,One very important thing I\xe2\x80\x99ve learned from many expert traders is to ask myself (without Biases) which direction will cause the most amount of pain ... then act accordingly. #crypto #Blockchain #trading #Cryptotrading #btc #bitcoin $BTC,2,0
2019-07-21 12:14:13,"Another great show, thanks all for joining! :) ""Live Show: Michael is in The House"" #investing #crypto #stocks #BitcoinCash $BCH #Bitcoin $BTC #Ethereum $ETH #Tesla $TSLAhttps://youtu.be/abpUD7uTnqI ",5,2
2019-07-21 11:13:03,"#bitcoin - $BTC\n\nThe meme backfired.\n\nLooks like a rejection from neckline, below 10300 pattern is officially invalidated - as that would mark a ""deeper"" shoulder.\n\nDon\'t get chopped out in ranges  pic.twitter.com/gfdiBiKvPw",36,2
2019-07-21 11:00:03,"Tomorrow\'s Bitcoin(BTC) forecast is\n        \n\xe2\x96\xb3UP 70% \n\xe2\x96\xbcDOWN 30%\n\n#Bitcoin, #BTC\n\nBitcoin Forecast (iOS)\nhttps://itunes.apple.com/app/id1404198250 \xe2\x80\xa6pic.twitter.com/9nC60QXPUM",0,0
2019-07-21 10:37:30,"If you\'re shorting bitcoin right now, you\'re about to get #REKT! #bitcoin #BTC #btc #ETH #LTC #XLM #Zcash #LitecoinFam #ZRX #monero #ICX #XMR #DecreD #wax #twitch #FOMO #altcoins #BitcoinIsBack #alts #ALTSEASON #cryptocurrency #cryptocurrenciespic.twitter.com/EIPbPK8szq",5,1
2019-07-21 10:15:46,"Grin Airdrop in bitforex exchange (NO KYC).\n\nJoin the link bellow and get 0,2 GRIN in your account!\nhttps://www.bitforex.com/en/invitationRegister?inviterId=1910410 \xe2\x80\xa6\n\nHurry!!!!\n\n#Airdrops #Bounty #Bitcoin #BTC #ETH #Ethereum #Coinbase #Binance #Bounties #Giveaway #Legit #Crypto #altcoin #ripple #trx #tron #XRP",1,1
2019-07-21 10:12:09,Two Devices\n\nThe \xe2\x80\x9cCryptoDefender\xe2\x84\xa2\xe2\x80\x9d Desktop or Mobile Keystroke Encryption Software \xe2\x80\x93 2 Device subscription.\n\n$5.99/month\n#BlockSafe #BSAFE #STO #bitcoin #btc and #cryptocurrency \nhttp://shop.blocksafetech.io/#gogrowglow09 ,7,5
2019-07-21 10:00:01,"Bitcoin - BTC\nPrice: $10,708.41\nChange in 1h: +0.09%\nMarket cap: $190,926,052,187.00\nRanking: 1\n#Bitcoin #BTC",0,0
2019-07-21 09:41:42,Read our #STO review in @tokenonline_ to learn why #security is paramount: https://bit.ly/30GutYt  #blockchain #crypto #SecuretheChain\n#BlockSafe #BSAFE #STO #bitcoin #btc and #cryptocurrency \n\nhttp://shop.blocksafetech.io/#gogrowglow09 ,6,4
2019-07-21 08:59:46,Just 3 more days to fill your $ECA bags..  The price movement already started. \n\nThere is a Big #Announcement on the 24th of July.. \n\nFollow @ElectracoinECA now. They will keep you posted.. \n\n#ElectraCoin #AltSeason #Bitcoin #Btc $Btc #Cryptocurrency #Ethereum #AltCoinspic.twitter.com/C3Y1HC6VHS,60,20
2019-07-21 08:36:28,$BTC $BTCUSD #BITCOIN - 1H: A bullish trend on Bitcoin - BTC/USD both in substance and in the short term. A purchase could be considered as long as the price remains above... https://www.centralcharts.com/en/6863-btc-usd/analysis/53406-btc-usd-1h \xe2\x80\xa6,1,2
2019-07-21 08:28:45,"No Blanket Ban on Cryptocurrencies in India, Government Says. A draft bill to completely ban cryptocurrencies is in the works though.\n#bitcoin #btc #Eth #ico #ieo #crypto #cryptocurrency #blockchain #technology #ledger #wortheum #news pic.twitter.com/mSdxd5iTBQ",10,2
2019-07-21 08:22:03,The truth about the current Bitcoin (#BTC vs #BSV) market cycle (note #BCH ignored... obviously): https://twetch.app/t/121c59027ea981db070dc6a6e4582bfb46611adea7fe87fc6af5edc6a298b37e \xe2\x80\xa6pic.twitter.com/vg0RlfqaSd,20,5
2019-07-21 07:39:21,Just opened a short position in BTC. \n\nFirst target $9182 \n\n#bitcoin #btc $btc $btcusd #crypto\n\nhttps://www.999trades.com/photos/60250/short-bitcoin \xe2\x80\xa6,4,1
2019-07-21 07:14:52,"The #Bitcoin halving, not even a year from now, will put the Bitcoin inflation at 1,8%, lower than the official inflation target by central banks at 2%!!\n\nIn 5 years, the BTC inflation will be pushed down to 0,9%, lower than that of Golds 1,6%!!\n\nBitcoin is digital scarcity!!",490,144
2019-07-21 07:14:37,Bitcoin (BTC) Price Weekly Forecast: Approaching Next Crucial Break https://ift.tt/32Jmwmy  #cryptocurrency #bitcoin #crypto #btc #cryptocurrencies,1,0
2019-07-21 06:14:02,Crypto excluding BTC is riding above the 9 DEMA line of support. Could be some massive Altcoin pumps soon.\n\n http://BitcoinLootbox.com/  \n\nRegister Now & Start Buying & Selling Cryptocurrency \n\n#Crypto #Cryptocurrency #Bitcoin #BTC #Ethereum #ETH #ETH2 #Ripple #XRP #EOSpic.twitter.com/NVn6WzsSWy,6,3
2019-07-21 05:12:32,"Credit Suisse\'s New Global Wealth Report:\n\nThere are now 36 million millionaires in the world. \nThere are only 21 million Bitcoin.  \nNot enough Bitcoin for the millionaires, imagine a day where every bearer of Bitcoin becomes a lender of first & last resort #bitcoin #btc $btc",2,2
2019-07-21 01:02:36,#Germany and #Netherlands are coming again.\nProberly this year \n\n#BeMyPilotWhale of #OceanEx\n\n$OCE $VET #VeFam\n#bitcoin $btc https://twitter.com/StarryOceanEx/status/1152671539780734976 \xe2\x80\xa6,32,4
2019-07-21 00:59:19,"#bitcoin $btc\n\nOn Daily, admit that we need a 200 EMA recharge, if we don\'t regain 11.8 level. \n\nSomething like this for a bull case. \n\nBear case, fails the retest of 200 EMA, corresponding fib levels plotted for support at 7300/6250. pic.twitter.com/lspFM4o1mt",6,3
2019-07-21 00:29:47,#Bitcoin $btc Bitcoin BTC\n\n#Crypto #cryptotrading #cryptocurrency pic.twitter.com/M0yIhsfzF3,0,1
2019-07-21 00:28:29,"Bitcoin Retakes $11,000 Following Turbulent Week in Crypto\n\nJuly 20 \xe2\x80\x94 #Bitcoin (BTC) has retaken the $11,000 price point on the heels of a turbulent week.\n\nAfter a bull #market at the end of June brought the price of\xe2\x80\xa6 https://www.instagram.com/p/B0KJ_REgrpu/?igshid=6inxfy11nldp \xe2\x80\xa6",0,0
2019-07-21 00:23:34,Bank run \n\n#cryptonews #cryptocurrency #Bitcoin #BTC $BTC https://twitter.com/Cointelegraph/status/1152734189617340421 \xe2\x80\xa6,0,0
2019-07-21 00:20:21,Order your secure and smart BTC/ETH/Altcoin hardware wallet - Only 94.80 EUR https://www.ledgerwallet.com/r/4518?path=/products/ledger-nano-s \xe2\x80\xa6 #bitcoin #btc #eth #altcoin 20:20pic.twitter.com/BWUh0f0f3d,0,0
2019-07-21 00:20:12,"Major Cryptocurrency latest prices(20,Jul 20:20)\n\n[Bitcoin(BTC)]  10,798.22 USD\n[Ethereum(ETH)]  228.79 USD\n[XRP(XRP)]  0.33 USD\n[Bitcoin Cash(BCH)]  329.20 USD\n[Litecoin(LTC)]  100.82 USD\n\nLearn more -> https://coins.lat \n#Cryptocurrency #bitcoin",0,0
2019-07-21 00:18:37,Match time [02:00 GMT] Real Salt Lake vs Minnesota United ;\nBet at http://bit.ly/cI0udBet  by #bitcoin #btc #soccer #live #sports pic.twitter.com/q97ipCyPbf #eth #ltc #xrp,0,0
2019-07-21 00:13:52,Daily profit for HODLING BTC since 2013 Data taken since 29/10/2018 @ 10:45am (UTC) Updated every hour #bitcoin #btc #cryptocurrency #blockchain #cryptotrade #profit #digitalminepic.twitter.com/1QBWYwa6nE,0,0
2019-07-21 00:10:06,"Bitcoin BTC Current Price:\n$10,750.50\n1 Hour: -2.31 % | 24 Hours: 2.20 % | 7 Days: -4.56 %\n#btc #bitcoin",0,0
2019-07-21 00:05:31,"#BTC/USD Daily Snapshot \n\n#Bitcoin\'s daily close finds some comfort above $10,750 on the close\n\nAO: Begun to tick up toward neutral 0, demonstrating an end to the correction, felt July 16\n\nRSI: Just hanging barely below neutral 50 (49.9)\n\nBullish should it hold abv 10.5k\n\n$BTC pic.twitter.com/ZfxNiTAmAE",29,6
2019-07-21 00:05:01,BTC Close: 10778.33 USD  \xe2\x96\xb2243.67\nHigh: 11065.46   Low: 10433.23\nhttps://www.bitcoinsqueeze.com/ \n#bitcoin #btc #bitcoinsqueezepic.twitter.com/vYHpVJJLuX,0,0
2019-07-21 00:04:32,If I\'m not mistaken this is a good indicator that $REN it\'s about to make another run!\n#RenVM #Renprotocol #Bitcoin $BTC pic.twitter.com/UPazAxuH9d,3,0
2019-07-21 00:03:32,"Said I wanted to see daily close above Monthly Open...\n\nWell GUESS WHAT ?!\n\nDaily close: $10,761\nMonthly Open: $10,761\n\nYou gotta be kidding me...\n\n(Coinbase prices)\n\n$BTC #Bitcoin pic.twitter.com/YqXyzsea7v",67,3
2019-07-21 00:03:27,"Bitcoin (BTC) Sees Watershed Moment in China, And It\xe2\x80\x99s Bullish via Ethereum World News #Cryptocurrency http://zpr.io/gcy5R ",1,0
2019-07-21 00:01:07,"Sunday July 21, 2019\nMonday July 22, 2019\n$btc #bitcoin #btc #vsky #pricebot #bitcoinpricepic.twitter.com/X7jTHdM6t4",0,0
2019-07-21 00:00:58,"SELL \n#BTCUSD - 10751.82\nSL - 11086.49\n50 Percent Profit Book - 10326.12\nAfter 50 percent Profit book, set Trailing SL = 10399.91 and let your Profit run. Exit immediately if you get BUY Signal.\n#BTC #Bitcoin $BTC",1,0
2019-07-21 00:00:35,#BTCUSD Market #1H timeframe on  July 20 at 23:00 (UTC)  is #Bullish.  #cryptocurrency #bitcoin #btc #crypto #trading #idea #report technical analysis,1,0
2019-07-21 00:00:32,$BTC- what a way to end the last hour of the day... #bitcoin with a strong rejection st $11K... pic.twitter.com/zclThyZ6Aa,128,16
2019-07-21 00:00:08,"https://bit.ly/2MmDPnZ  <<< Don\'t pass up easy \xe2\x82\xbf like this,Refer friends & receive 10% of their earnings too #Bitcoin #BTC #Crypto #CryptoCurrency #WorkFromHomepic.twitter.com/qjQRwpwvmL",0,0
2019-07-21 00:00:07, #Bitcoin (#BTC $BTC) global volume weighted average is currently $10753.237 | 3.68% change over 24hrs.  #crypto #blockchain #market #news #coin #trading #cryptocurrency https://coincircus.io/BTC  ,0,0
2019-07-21 00:00:04," 03:00\n\xe2\x82\xbf Bitcoin = 10.558,8620 $\n#bitcoin #btc #BTCUSD",0,0
2019-07-21 00:00:01,"Bitcoin - BTC\nPrice: $10,771.41\nChange in 1h: -1.94%\nMarket cap: $192,039,831,197.00\nRanking: 1\n#Bitcoin #BTC",1,0
