date,text,likes,retweets
2019-06-12 22:00:07,Craig schooling Financial Times on why BTC is NOT #Bitcoin.  Bitcoin is now only #BSV.https://ftalphaville.ft.com/2019/06/12/1560351485000/SegWit-and-the-bitcoin-transaction-fee-conspiracy-theory/ \xe2\x80\xa6,182,64
2019-06-12 08:02:08,"XRP Is Safe From Facebook\xe2\x80\x99s Coin, But Bitcoin (BTC) Is Reportedly Threatened https://oracletimes.com/xrp-is-safe-from-facebooks-coin-but-bitcoin-btc-is-reportedly-threatened/ \xe2\x80\xa6 #bitcoin #btc #Facebook",137,53
2019-06-12 15:09:44,#Bitcoin $BTC back above $8k  pic.twitter.com/YBUYXYflsm,68,8
2019-06-12 18:09:28,Got a DM from a friend of mine that trades with some serious size - he said price will move up or down in the next week. \n\nI tend to believe him.\n\n$BTC #BITCOIN,204,4
2019-06-12 17:15:35,Coming tomorrow pre-market... Full $BFCH DD Pack highlighting all of the progress and potential of this investment. Some major catalyst the past 12 months. #Bitcoin #cryptocurrency #Blockchain $BTC $LTC \n$VSHC $GMNI $XALL $NDYN $STMH $EMPM $VMCS $BOPO pic.twitter.com/N8XOdY9k4n,22,14
2019-06-12 21:30:26,"Could Bitcoin Hit $50,000? In Wild World of Crypto Options, Some Say Yes  https://on.wsj.com/2QZ3YJk  #bitcoin #blockchain #btc #crypto #money #altcoins #altcoin #bitcoinnews #cryptocurrency #cryptonews #cryptopricepic.twitter.com/IMdwEkjzrf",6,1
2019-06-12 20:16:41,BECAUSE WE\'RE DIFFERENT. SOLUTIONS THAT CRESIO OFFERS.\nhttps://cresio.io           \n\n#btc #bitcoin #cresio #cres #trade #trading #signals #airdrop #bounty #ethereum #xrp #ripple #multiexchange #exchange #cryptocurrency #ico #blockchain #investor #profit #crypto #investpic.twitter.com/sFUdHUmTEK,49,25
2019-06-12 10:03:09,The Coinbase #visa card is issued in 6 more #European countries! Are you living in one of them?\nhttps://cointelegraph.com/news/coinbase-card-launches-in-six-european-countries \xe2\x80\xa6\n\n#AUPC #Authpaper #Coinbase #crypto #Spain #Germany #France #Italy #Ireland #Netherlands #blockchain #ICO #bitcoin #BTC #ETH,124,163
2019-06-12 19:39:28,"After barely a week live, we already have a new $DVT Core Wallet release! #DeVault Core 1.0.1 is now live on http://www.devault.cc/wallets.html \n\nThis is NOT a mandatory update, but does have some improvements and quality of life improvements.  #DeVaultEconomy $btc #bitcoin #btc pic.twitter.com/muHDJsZrxm",11,7
2019-06-12 19:33:50,"#WillemMiddelkoop founder #CommodityDiscoveryFund: ""We are a bit in the twilight zone, because the institutes are starting to get involved in #crypto & if the institutional world decides to treat crypto as a real asset class then we can expect very special things!""\n\n#Bitcoin #BTC pic.twitter.com/KPrDn1U6Fs",12,2
2019-06-12 16:52:14,They are coming after your stash #bitcoin #btc #cryptocurrency http://www.zdnet.com/article/lazarus-hacking-group-rises-again-with-new-bitcoin-stealing-cyberattacks-targeting-banks/ \xe2\x80\xa6,1,0
2019-06-12 08:28:51,Female adoption is at an all-time high! \n\nMore women in Bitcoin shows adoption is spreading. \n\n$btc #bitcoin #btc #cryptocurency  \n\nhttps://bitcoinist.com/women-in-bitcoin-engagement-new-high/ \xe2\x80\xa6pic.twitter.com/N7yeEqVLZD,31,3
2019-06-12 23:52:17,Ethereum. \n\n#Crypto #Cryptocurrency #Bitcoin #BTC #Ethereum #ETH #Ripple #XRP #EOS #Stellar #Litecoin #LTC #Cardano #Monero #TRON #IOTA #Dashpic.twitter.com/0RBPnVRd5n,5,3
2019-06-12 18:28:45,The future is definitely NOT priced in to #bitcoin $BTC,8,3
2019-06-12 21:00:15,"#bitcoin - $BTC\n\nMacro I\'m very bullish, because of it I find it very valuable to spot bearish patterns, as it will balance my bias, here we have one:\n\nDescending triangle \n\n- Bullish, daily close above red and weekly resistance\n- Bearish, rejection and break of support pic.twitter.com/IsLNFe40Ds",30,1
2019-06-12 20:11:17,SegWit and the bitcoin transaction fee conspiracy theory \n\nFINANCIAL TIMES\n\nhttps://buff.ly/31we35A \n\n#fintech #banking #blockchain #btc #bitcoin #crypto\n@jblefevre60 @NeiraOsci @sebbourguignon @AntonioSelas @dinisguarda @Stevewal63 @missdkingsbury @AshokNellikar @diioannidpic.twitter.com/7SIJSseJua,20,17
2019-06-12 22:05:01,"Coinbase Launches Its Crypto Debit Card in Europe. Will It Push Bitcoin Price to $10,000?\n\n@Coinbase #Coinbase #Crypto #Bitcoin #BTC $BTC #CoinbaseCardhttps://u.today/coinbase-launches-its-crypto-debit-card-in-europe-will-it-push-bitcoin-price-to-10000 \xe2\x80\xa6",12,3
2019-06-12 22:50:12,"As of June 11, 2019 at 05:50PM, 1 ETH = 255.01 USD.  https://goo.gl/E2Ee6A   #Investing #fire #ira #401k #money #stock #retirement #trade #NeverWorkAgain #CapitalGain #Savings #PersonalFinance #crypto #ethereum #eth #bitcoin #btc",2,0
2019-06-12 17:13:56,ZenGO Implementing Open-Source TSS to Zilliqa Coin (ZIL) https://zengo.com/implementing-open-source-tss-to-zilliqa-coin-zil/ \xe2\x80\xa6\n\n#bitcoin $btc #ethereum $eth #cardano $ada #zilliqa $zil #litecoin $ltc #tron $trx,4,0
2019-06-12 05:53:46,PayPal Wins Patent for Way to Defend Against Crypto Ransomware\nhttps://bit.ly/2KOgAnj  \n\n#crypto #cryptocurrency #ethereum #bitcoin #btc #bitcoinnews #technologies #latestnews,0,0
2019-06-12 22:20:31,Help us test our #smartcontracts system. http://dcentlife.io  is offering free UnLtd. #tokens to the next 100 customers.\n\n#bitcoin #btc #ethereum #eth #litecoin #ltc #blockchain #decentralized #dcentlife,3,0
2019-06-12 21:59:29,Now is a key time to accumulate more litecoin \n\n#ltc #litecoin #bitcoin #btc,38,5
2019-06-12 18:09:53,"Bitcoin Price Analysis: Triangle Breakout Tests $8,300\n\nResistance: $8,200 and $8,300.\nSupport: $8,000, $7,700 and $7,500.\n\n#Bitcoin #BTC $BTC $BTCUSDhttps://coingape.com/bitcoin-price-analysis-triangle-breakout-test-8300/ \xe2\x80\xa6",3,0
2019-06-12 16:34:55,coinexpansion - an altcoins and exchange hub https://buff.ly/2IaUTt2 \n#coinexpansion #crypto #cryptoexpert #blockchain #cryptonews #cryptomarket #cryptocurrency #bitcoin #BTC #ethereum #litecoin #cryptoexchange #trading #bitcoinexchangepic.twitter.com/pTRq7WbIDV,1,0
2019-06-12 18:43:50,"News Aggregated By BitcoinPrices.Stream-- Bitcoin (BTC) Halving In An Electioneering Year, Is LTC Pacesetting? -- https://www.newsbtc.com/2019/06/12/bitcoin-btc-halving-in-an-electioneering-year-is-ltc-pacesetting/ \xe2\x80\xa6 #Crypto #Cryptonews",2,0
2019-06-12 21:21:27,We\xe2\x80\x99re already building on the moon #BTCtothemoon #tothemoon \n.\n.\n.\n.\n.\n.\n#crypto #cryptoexchange #bitcoin #BTC #ethereum #ETH #Binance #BNB #BinanceCoin #useBNB #blockchain #cryptomining #datacenter #trading\xe2\x80\xa6 https://www.instagram.com/p/Byn-YBXA3kc/?igshid=1a10dr3ff6njd \xe2\x80\xa6,1,0
2019-06-12 18:59:16,GIVING 10 XLM (STELLAR LUMENS)\n\n-Use my coinbase link and complete one lesson. \n-Reply to this post or DM me for 10 XLM :)\n\n#crypto #Airdrops #freecrypto #xlm #bitcoin #BTC #cryptocurrency #Giveawayyhttps://coinbase.com/earn/xlm/invite/m5h2crtp \xe2\x80\xa6,1,0
2019-06-12 18:01:44,Coinbase expands its cryptocurrency debit card to Europe \n\nhttps://www.cnbc.com/2019/06/12/coinbase-expands-its-cryptocurrency-debit-card-to-europe.html \xe2\x80\xa6\n\n#crypto #cryptocurrency #bitcoin #btc @coinbase,0,0
2019-06-12 15:45:50,#Bitcoin #BTC price on June 12th each year... pic.twitter.com/tRZad73CVq,4,1
2019-06-12 15:34:40,"Interest in Bitcoin, Ethereum and XRP Shifting Around the World\n\n#Bitcoin #BTC $BTC #Ethereum #ETH $ETH #XRP $XRPhttps://dailyhodl.com/2019/06/12/interest-in-bitcoin-ethereum-and-xrp-shifting-around-the-world/ \xe2\x80\xa6",6,0
2019-06-12 18:48:03,Truth and nothing but the truth.....#BITCOIN #BTC https://twitter.com/APompliano/status/1064141922183335936 \xe2\x80\xa6,7,2
2019-06-12 17:32:32,Earn bitcoins for clicking ads https://btcclicks.com/?r=48c2a034  #bitcoin #BTC #Cryptocurrency #Crypto #RambleOn,2,1
2019-06-12 17:34:15,We have broken above the Current Supply Edge and the main supply line. Holding above this would be very bullish. I expect some consolidation around this edge before next move. #btc #bitcoin #xbtusd $btc $xbtpic.twitter.com/FuCPzOVrjt,7,0
2019-06-12 21:26:56,$BNB #BNB got over the $34.80 obstacle and now it is looking to shoot past it\'s ATH of $35.55!!!\n\nNext stop - $38\n\n#eth $eth #ltc $ltc #xrp $xrp #bitcoin #btc $btc,3,1
2019-06-12 19:35:21,"Bitcoin (BTC) Halving In An Electioneering Year, Is LTC Pacesetting? http://twib.in/l/5jM9g6B6ArMB  via @DCryptostar #cryptocurrency #cryptoupdates",1,0
2019-06-12 19:53:26,Interview JUSTIN BONS about Bitcoin\'s Failing Ideology and the alternatives.. https://youtu.be/FkbjKJT_Hqo  #bitcoin #btc #bch #eth @justin_bons,6,3
2019-06-12 23:15:18,Mainstream media be like: #Bitcoin #BTC #BTCUSD #btcnews #Crypto #cryptocurrency #memespic.twitter.com/AtjiTIGguL,2,0
2019-06-12 21:11:38,Bitcoin technical analysis ; market update. - 12.06.2019 -\n\nMy last BTC TA (bitcoin technical analysis) ; market update.\n\nYouTube video :  \nhttps://youtu.be/QYG6Fk7wDlc \n\nWebsite :\nhttps://torycrypto.wixsite.com/tory-crypto \n\n#Bitcoin\n#BTC\n#Blockchain\n#Crypto\n#trading\n#myvideo\n#video\n#videooftheday,2,0
2019-06-12 20:11:22,"Trade #Bitcoin and 14 other #Cryptocurrency CFDs at EverFX http://twib.in/l/ABoozKpdy6pk  Bitcoin (BTC) Needs to Pass $8,200 to Kickstart Next Leg Higher http://twib.in/l/dg8EayLkxkkb pic.twitter.com/daZD9U7Y6q",1,0
2019-06-12 21:22:42,$10k incoming #bitcoin #btc #blockchainpic.twitter.com/m4CJd3Zy6j,1,0
2019-06-12 20:04:46,"1 Bitcoin ( #BTC )\nDollar: 8173.48$ \n\n1 Bitcoin Cash ( #BCH )\nDollar: 3,94.30$ \n\n1 Ethereum ( #ETH )\nDollar: 256.84$ \n\n1 Ripple ( #XRP )\nDollar: 0.40002$ \n\nDate: 12 Jun 2019 20:4\n\n#Bitcoin #Ethereum #cryptocurrency #crypto #altcoin #Blockchain #Ripple",2,0
2019-06-12 19:57:54,Justin Sun will take Warren Buffett to a restaurant in Silicon Valley - a big move for the notoriously picky billionaire investor. http://ow.ly/w56o50uCDcH  via @danielgkuhn\n\n#FCoin #FCoinJP #FCoinAsia #FCoinEurope #FMEX #Bitcoin #BTC #ETH #XRP #TRON #TRX #crypto #Competitions,9,3
2019-06-12 23:33:15,Bitcoin [BTC] prices share striking resemblance with China\'s RMB futures\n\nhttps://ambcrypto.com/bitcoin-btc-prices-share-striking-resemblance-with-chinas-rmb-futures/?utm_source=twitter.com&utm_medium=social&utm_campaign=bitcoin-[btc]-prices-share-striking-rese \xe2\x80\xa6\n\n#Bitcoin #BTC #CryptoNews #RMB #China,3,1
2019-06-12 21:20:59,"Some awesome things are happening in the #cryptocurrency world. I made a video talking about two things I found interesting today. Ubisoft and #Blockchain, and @coinbase releasing their #crypto visa card in Europe. Watch the video here:\nhttps://www.youtube.com/watch?v=tW78fzn3hH4 \xe2\x80\xa6\n #bitcoin #BTC",27,23
2019-06-12 14:38:56,Crypto Transparency Ruling For US-Based Firms - What Will Gain? #cryptonews #cryptocurrency #bitcoin #btc #monero #binance https://youtu.be/TBXddcahlSQ  via @YouTube,0,0
2019-06-12 16:41:25,"Live cryptocurrency prices list - 1700+ altcoins live price, charts, & more https://buff.ly/2KLHeLK \n#crypto #cryptocurrency #altcoin #altcoins #cryptomarket #cryptocurrencymarket #coinmarketcap #coins #bitcoin #BTC #altcoinsprices #bitcoinpricepic.twitter.com/yv9dLHR3cx",1,0
2019-06-12 23:48:06,@NextExchange support $btc @Bitcoin #btc merge mining. almost 45% in every block allocated on mining. @miningnews @miningpoolstats @MiningPoolHub @btcminerpic.twitter.com/T1ar38FYOB,4,1
2019-06-12 12:57:14,Invest and Bet with #Bitcoin #BTC at https://bit-exo.com                               \n\nTotal Invested:\n5.71194093 BTC\n\nTotal Wagered:\n310.01416473 BTC\n\nTotal Profit:\n5.20824113 BTC\n\nMax Profit Per Bet:\n0.04903439 BTC\n#crypto #casino #provablyfairpic.twitter.com/X0Ttt13LkZ,3,2
2019-06-12 20:30:53,$GLD gold should be up in the overnite session. Will be watching along with Bitcoin. #BTC $BTC $GBTC,3,0
2019-06-12 12:36:29,Anthony Pompliano Bullish Bitcoin (BTC) Price Prediction \xe2\x80\x9c5 Trillon Asset by 2024\xe2\x80\x9d\nhttps://cryptolauren.com/2019/06/12/anthony-pompliano-bullish-bitcoin-btc-price-prediction-5-trillon-asset-by-2024/ \xe2\x80\xa6\n\n#McAfee #hodl #mastering #btc #bitcoin #BitcoinCash #blockchain #BlockchainWeek #Ripple #RippleNet #network #InternetOfThings #technology #TechNews #Engineering,1,0
2019-06-12 08:57:00,Andreas Antonopoulos at @CryptoCompare Digital Asset Summit.\n#bitcoin #btc pic.twitter.com/Kx33lCLNQn,1,1
2019-06-12 15:18:40,Hi Elon do you have any litecoin?\n##ltc #litecoin #bitcoin #btc @SatoshiLite @mrilirgashi,16,2
2019-06-12 17:03:53,Bitcoin\'s returns in 10 years trump Berkshire Hathaway\'s returns since 1964\n\nhttps://ambcrypto.com/bitcoins-returns-in-10-years-trump-berkshire-hathaways-returns-since-1964/?utm_source=twitter.com&utm_medium=social&utm_campaign=bitcoins-returns-in-10-years-trump-berk \xe2\x80\xa6\n\n#Bitcoin #BTC #CryptoNews #WarrenBuffett,3,1
2019-06-12 21:57:01,"XRP Is Safe From Facebook\'s Coin, But Bitcoin (BTC) Is Reportedly Threatened #Bitcoin #btc #Facebookhttps://oracletimes.com/xrp-is-safe-from-facebooks-coin-but-bitcoin-btc-is-reportedly-threatened/ \xe2\x80\xa6",0,0
2019-06-12 19:29:16,"Bitcoin Analyst: Beware of Facebook\xe2\x80\x99s \xe2\x80\x98Crypto\xe2\x80\x99, Big Trouble for Major Banks, Authoritarian Regimes and the Financial Services Industry\n\n#Crypto #Bitcoin #BTC $BTC #GlobalCoinImpacthttps://dailyhodl.com/2019/06/12/bitcoin-analyst-beware-of-facebooks-crypto-big-trouble-for-major-banks-authoritarian-regimes-and-the-financial-services-industry/ \xe2\x80\xa6",2,0
2019-06-12 17:04:24,#MinuteCrypto #Bitcoin $BTC $Cryptopic.twitter.com/nLp2OCZldR,13,0
2019-06-12 21:12:06,"Bitcoin Breakout to $10,000 Brewing? Crypto Analyst Says BTC at Critical Moment\n\n#Bitcoin #BTC $BTC #Crypto\nhttps://dailyhodl.com/2019/06/12/bitcoin-breakout-to-10000-brewing-crypto-analyst-says-btc-at-critical-moment/ \xe2\x80\xa6",2,0
2019-06-12 16:08:07,The Community Committee Passed the Resolution on pre-selection process of Candidates for FT Community Committee:\nhttps://fcoin.zendesk.com/hc/en-us/articles/360024542974 \xe2\x80\xa6\n\n#FCoin #FCoinJP #FCoinAsia #FCoinEurope #FMEX #Bitcoin #BTC #ETH #XRP #TRON #TRX #crypto #Competitionspic.twitter.com/KbxJzHi9lW,6,2
2019-06-12 17:00:28,CryptoShark is getting a makeover \nIt is now adapted to the new Coin Market Cap and manages more than 2225 cryptocurrencies \n https://t.me/ButterInTheSpinachBot \xe2\x80\xa6\n\nSome new features should be available soon. \n#cryptocurrency #cryptocurrencies #bitcoin #btc #ether #Ripple #Telegram,1,1
2019-06-12 10:03:20,I don\'t believe in coincidence. It\'s happening\n#bitcoin #BTC #Ethereum #ETH #ripple #XRP #Litecoin #LTC #TRON #TRX #Binance #BNB #BasicAttentionToken #BAT #Cosmos #XLM #eosio #bchsv #XMR #dash #IOTA #tezos #NEO #Ont #MKR #Vechain #VET #SHA #PLA #OCE #Blockchain #cryptocurrency https://twitter.com/wazapepe/status/1135258520968925186 \xe2\x80\xa6pic.twitter.com/PhZOtKYLR3,21,2
2019-06-12 19:58:40,More people understand how Bitcoin works than how the \'Reserve Bank of India\' works.\n\nBanks are complicated to hide the truth.\n\nBitcoin is simple to show the truth.\n\n#IndiaWantsCrypto\n\n#bitcoin #btc,15,3
2019-06-12 20:19:19,Lovely chart\n\n#Bitcoin $BTC https://twitter.com/100trillionUSD/status/1138894266531483648 \xe2\x80\xa6,2,0
2019-06-12 19:14:40,#Bitcoin $BTC continues to rise despite facing numerous bearish prediction from technical analysts https://u.today/bitcoin-price-is-on-track-to-test-8500-again \xe2\x80\xa6,1,1
2019-06-12 20:06:05,"Bitcoin (BTC) Price Turns Bearish: Bulls Could Face Resistance Near $7,800\nhttps://tribetica.com/bitcoin-btc-price-turns-bearish-bulls-could-face-resistance-near-7800/ \xe2\x80\xa6\n\nhttp://reddit.com/r/tribetica \n#newsoftheweek #Bitcoin #blockchain #crypto pic.twitter.com/ofkSu0yjSU",3,1
2019-06-12 21:00:03,"Tomorrow\'s Bitcoin(BTC) forecast is\n        \n\xe2\x96\xb3UP 80% \n\xe2\x96\xbcDOWN 20%\n\n#Bitcoin, #BTC\n\nBitcoin Forecast (iOS)\nhttps://itunes.apple.com/app/id1404198250 \xe2\x80\xa6pic.twitter.com/1SGlqKlHeF",0,0
2019-06-12 17:06:58,Yes! Let\xe2\x80\x99s go! Let\xe2\x80\x99s launch MimbleWimble! \n\n@ecurrencyhodler \n@SatoshiLite @mrilirgashi @thrasher_au \n\nWe are ready. \n\n#ltc #litecoin #bitcoin #btc,8,1
2019-06-12 18:36:56,"The CryptoDefender suite from BlockSafe Technologies is a bet to allow hot wallet users to enjoy the level of security they would expect from cold storage, but from the comfort of their laptops, smartphones and the like. #BlockSafe #BSAFE #STO #bitcoin #btc and #cryptocurrency",3,3
2019-06-12 20:42:45,"with the launch of our new exchange in less than 2 weeks, we are swapping our cmc token to c-cash the supply is reducing by almost 90% #Ccash #crypto #Blockchain #bitcoin #btc #ripple #xrp #ethereum #eth #bch #xlm #eos #etc #neo #trx #xvg #tron #ico #ieo #sto #pso #ito #buildlpic.twitter.com/7OWoLFbkb3",37,6
2019-06-12 10:58:09,"Bitcoin doesn\'t care. Subscribe to us on YouTube to get market updates, insights, trade alerts, coaching, $10 free Bitcoin, & more.\n\n#bitcoin \n#btc \n#bitcoinmining \n#bitcoinnews \n#cryptocurrency\n#technicalanalysis \n#trading \n#money \n#bullandbearcrypto http://bit.ly/2Zoemxs pic.twitter.com/DzTIHAVwwA",2,0
2019-06-12 22:04:46,"1 Bitcoin ( #BTC )\nDollar: 8149.80$ \n\n1 Bitcoin Cash ( #BCH )\nDollar: 3,94.60$ \n\n1 Ethereum ( #ETH )\nDollar: 257.72$ \n\n1 Ripple ( #XRP )\nDollar: 0.40031$ \n\nDate: 12 Jun 2019 22:4\n\n#Bitcoin #Ethereum #cryptocurrency #crypto #altcoin #Blockchain #Ripple",1,0
2019-06-12 11:33:23,"@BlockSafeTech\nAn excellent project from a very promising team, the guys are really engaged in the project and its development and popularization.\n#BlockSafe #BSAFE #STO #bitcoin #btc #cryptocurrency",3,2
2019-06-12 18:33:36,"LocalBitcoin\'s volume resurgence holds steady, despite Iran pullout\n\nhttps://ambcrypto.com/localbitcoins-volume-resurgence-holds-steady-despite-iran-pullout/?utm_source=twitter.com&utm_medium=social&utm_campaign=localbitcoins-volume-resurgence-holds-s \xe2\x80\xa6\n\n@LocalBitcoins #LocalBitcoins #Bitcoin #BTC #CryptoNews #Iran",4,0
2019-06-12 21:26:04,"Market Analysis: Bitcoin (BTC) Rises to $8,200, Total Crypto Market Cap Gains $7 Billion, Litecoin (...\n\nThe price of Bitcoin (BTC) has generally been rising over the past few days from $7,530 Monday evening to as high as...\n\n#bitcoin #btc #trading #gainshttps://is.gd/gZZytw ",0,0
2019-06-12 19:28:58,Exciting times for $KUBO!  They have alot of things planned this summer in preparation for #Mainnet\nLaunch this fall. Load up while it\'s still under 1 sats! \n\n#kubo #kubostrong #kubodex #kubolink #crypto #cryptocurrency #cryptotrading #blockchain #bitcoin #btc #ethereumhttps://twitter.com/KuboCoin/status/1138859672230932480 \xe2\x80\xa6,3,0
2019-06-12 20:23:07,"#btc #bitcoin #crypto #FOMO\nBitcoin (BTC) Is Back Above $8,100, Will It Hold Above $8,000 This Time? https://www.hvy.com/jkiguru/bitcoin-btc-is-back-above-8100-will-it-hold-above-8000-this-time \xe2\x80\xa6 via @hvyjournalists",0,0
2019-06-12 17:01:37,"Know how good you are in predicting #esports matches and who knows, maybe your skills can turn into good profits. Leave a tip now on Tipify! \n\nWin BTC!! 100% FREE  http://bit.ly/TipsterEsports  \n\n#Bitcoin #BTC #tipster #competition #FreeBetspic.twitter.com/I8OAwwReBP",0,0
2019-06-12 23:10:04,"Bitcoin BTC Current Price:\n$8,154.74\n1 Hour: 0.13 % | 24 Hours: 2.81 % | 7 Days: 4.19 %\n#btc #bitcoin",0,0
2019-06-12 20:39:43,"Everyone can enter the reseller mode, as long as they check the origin of the product. With vip2fan they all win.\n\n#blockchain #bitcoin #BTC #crypto #cryptocurrencynews #cryptocurrency #news #japan #fintech #startup #marketing #fanspic.twitter.com/3PEVl8cMxm",4,1
2019-06-12 20:00:34,Take a deeper look at the actual amount of bitcoins that exist.\n\nhttps://buff.ly/2XJPlwe \n\n#crypto #cryptocurrency #cryptocurrencies #blockchain #altcoin #altcoins #bitcoin #BTC #digital #news #money #trading #banking #finance #coin #portfolio #investment #altcoimagazinepic.twitter.com/zu2U9fuEJG,0,0
2019-06-12 19:40:25,Decentralized Global Fantasy Sports Is HERE! Digital Fantasy Sports Explained!\nhttps://youtu.be/8fe5vpkZvRI \n$trx $tron $BTC $ripple $XRP $ETH $ADA $bch $XVG #Ripple #XRP #TRX #Coinbase #robinhood #cardano #bnb #crypto #cryptocurrency #eth #ethereum #bitcoin #binance #bitcoin #btc,3,0
2019-06-12 19:30:01,What are the red flags to look out for in an #ICO? Learn more in this article.\n\nhttps://buff.ly/31vAh7o \n\n#crypto #cryptocurrency #cryptocurrencies #blockchain #altcoin #altcoins #bitcoin #BTC #digital #news #money #trading #finance #coin #portfolio #investment #altcoinmagazinepic.twitter.com/wAkTw2CoWD,0,0
2019-06-12 18:09:09,"Right shoulder now complete. As mentioned earlier, a failure to close above 8300 is still a good sign that bears are still in control. We have been stuck in a 7-10% bear flag range for over a week, which is ready to resolve to the downside. \n\n$crypto $BTC $btcusd #bitcoin #btc pic.twitter.com/c9BY9nVNDV",2,0
2019-06-12 18:04:46,"1 Bitcoin ( #BTC )\nDollar: 8152.76$ \n\n1 Bitcoin Cash ( #BCH )\nDollar: 3,92.99$ \n\n1 Ethereum ( #ETH )\nDollar: 257.35$ \n\n1 Ripple ( #XRP )\nDollar: 0.39985$ \n\nDate: 12 Jun 2019 18:4\n\n#Bitcoin #Ethereum #cryptocurrency #crypto #altcoin #Blockchain #Ripple",0,0
2019-06-12 17:53:30,"These BTC maximalists were never this anti Litecoin. Look how things are changing as the value increases and there\'s bullish news for it one after the other. However, the LTC community is helping Bitcoin adoption more than any other crypto.  \n#Litecoin #LTC #Bitcoin #BTC",1,0
2019-06-12 17:25:42,We\'ve moved past $8135 but we stumbled on an old resistance. Bulls need to smash that one and reach 8600!  \n\n#CRYPTO #BITCOIN $BTC pic.twitter.com/x3yuCAkTR9,2,0
2019-06-12 16:53:01,"""Report: #CEO of Major American #VC Firm #DigitalCurrency Group: #CryptoWinter Is Ending"" - Have faith #CryptoTwitter, it looks like it may finally be time for the #Crypto Spring. #Cryptocurrency #Blockchain #Bitcoin $BTC\nhttps://buff.ly/2XEO4GJ  via @Cointelegraphpic.twitter.com/Goz3skQ6ww",2,0
2019-06-12 16:32:26,This is what I\'m anticipating over the next couple of weeks into July. Best of luck all. #bitcoin $btc #crypto #forexsignals $spypic.twitter.com/NIgPFrtfXK,2,1
2019-06-12 16:15:01,Love making great content for friends who have made blockchain related companies. The best part they respect the craft so they pay my fee. #bitcoin #btc,1,0
2019-06-12 15:49:14,Managed to catch Tom Lee (@fundstrat) at the @CryptoCompare summit. Lee explains how FOMO could lead us to another major rally. Give it a spin. #Bitcoin #BTC #cryptocurrency #CryptoCompareSummithttps://twitter.com/Chepicap/status/1138817389091577857 \xe2\x80\xa6,1,0
2019-06-12 12:48:36,The best resource out there to learn about Bitcoin. \n\n$BTC #Bitcoin #cryptotwitterhttps://twitter.com/lopp/status/1138439891065417729 \xe2\x80\xa6,0,0
2019-06-12 12:36:35,"A quick snapshot of #fiat deposits, through #PayPal on our upcoming #Ebarter #trading platform based on\n\n#cryptocurrency (#bitcoin #btc, #ethereum #eth, #bitball #btb, #bitballtreasure #btrs)\n&\n#fiat (#dollar, #euro, #pound or any other)\n\n#Youtube video: https://youtu.be/2Igc9xjVxBA pic.twitter.com/cQtOyaNd2S",13,8
2019-06-12 12:25:02,IF #bitcoin \n $BTC up to $9000 on tonight\nI will send 0.001 $BTC to who LIKE AND RT\n\n#BTC $BTC #ETH $ETC $ETH $NEO $LTC $XRPpic.twitter.com/81JLDyAg2p,83,67
2019-06-12 12:24:05,"We are giving away 10,000 #LTC\n\nSteps:\n1. Retweet\n2. Like\n3. Follow \n\nTo participate you have to complete all 3 steps. Ends in 5 Days.\n\n#crypto #cryptocurrency #bitcoin #blockchain #giveaway #win #ethereum #btc #LTC #market #xrp #ico #Doge #trading #XMRpic.twitter.com/bA9La5aIly",505,445
2019-06-12 12:07:08,"Ripple vs Bitcoin: BTC Again Dips Below 8000 USD, XRP Continues with Bearishness https://www.cryptonewsz.com/ripple-vs-bitcoin-btc-again-dips-below-8000-usd/25359/ \xe2\x80\xa6 via @cryptonewszcom\n#Bitcoin #BTC #Ripplle #XRP #Comparsion #Crypto #Blockchain #Analysis",0,0
2019-06-12 11:50:05,The #domains.ZIL auction starts on June 27th! @unstoppableweb @zilliqa #ProgressNotHype\n https://unstoppabledomains.com/auction \n\n$zil #zil #zilliqa #bitcoin #btc #eth #ethereum #xrp #ripple #bch #ltc #eos #xlm #stellar #ada #cardano #xmr #tron #trx #dash #iota #bnb #neo #etc #xem #xtc #zec #vetpic.twitter.com/V8nt195i5R,11,4
2019-06-12 11:35:13,"MONEYMAN @BCFMONEYMAN1 giving upcoming Rappers #FinancialAdvice: ""Don\'t invest too much money in jewelry, invest in Bitcoin and property""!\n\n#Bitcoin #BTC #InvestInBitcoin #crypto #cryptocurrency #cryptonews #rap #celebritiespic.twitter.com/VFMswP3w4W",17,4
2019-06-12 11:14:29,  AIRDROP BITCOIN BLACK \n               ($36 value)! \n           \n$BTC $ETH $LTC $TRX $BTT $XRP\n$BCH $BNB $ICX $ATOM $ADA $NEO $ONE $SNT $OST $POE $XVG $BOLT $TFUEL $MATIC $PHB $FTM $CRYPTO #BITCOIN #BTC #CRYPTOCURRENCY \n\n https://bitcoin.black/#a_aid=5cf6481ff0198 \xe2\x80\xa6,2,1
2019-06-12 11:00:02,"Tomorrow\'s Bitcoin(BTC) forecast is\n        \n\xe2\x96\xb3UP 60% \n\xe2\x96\xbcDOWN 40%\n\n#Bitcoin, #BTC\n\nBitcoin Forecast (iOS)\nhttps://itunes.apple.com/app/id1404198250 \xe2\x80\xa6pic.twitter.com/XlTe08WnNH",0,0
2019-06-12 10:51:20,"CSW is literally telling you that he is Satoshi, BSV is Bitcoin, BTC/BCH are fakes, and that he will DUMP massive BTC in the near future. If you holding any crypto other than BSV right now, you dumb LOL #BitcoinSV #Bitcoin #BSV #BTC #BCH #crypto #SatoshiNakamoto",141,32
