date,text,likes,retweets
2019-03-30 13:06:29,"Who will you call first using your #DENT App?  Tomorrow Sunday, 31. March 2019 at 23:59 UTC the latest, the DENT WORLD TELCO and DENT #AFTERBURNER Loyalty Program, 2 major #Milestones for Q1 will go LIVE! Join DENT Exchange: https://dent.exchange  #dentcoin #btc #bitcoin #bnbpic.twitter.com/agk10f1kLf",291,115
2019-03-30 18:34:59,A personal message from Bitcoin to @VitalikButerin \n\n#VitalikforMitalik #btc #bitcoin #ethereum #btcandfriendspic.twitter.com/PD01v2p9uD,183,30
2019-03-30 22:16:32,"Let\'s begin the 300 #Followers #GIVEAWAY!\n\nWe are SO THANKFUL for the continued support as the #WolfPack grows!\n\nWe are giving away 300 #XRP to show our appreciation!\n\nFollow @LWDayTrading \nRe-tweet\nTag 5 #Friends\nComment ""Done""\n\n#LTC #Bitcoin #BTC #XRP #ETH",152,134
2019-03-30 16:13:18,"#XRP holders are holding the future Global Reserve Currency. Its not going to be #Bitcoin as some expect because $BTC only has arrificial value. XRP will be used by banks/FI\'s/companies etc across the globe. This means democracy, this means the world contributes to its value.",525,119
2019-03-30 20:09:25,Bitcoin: June should be very interesting.. Think we ranging between 3500$ and 4750 until then. What you think? @crypToBanger.. #btc #bitcoin #btcusd #crypto pic.twitter.com/RiBCpSPe6i,138,55
2019-03-30 16:41:14,"Checkout @EunoCoin #Masternode \n\nMonthly income @ $54.95 as of today.\n\nCurrently 182 #Masternodes are active, 9.1Millions coins are locked . Circulation supply is around 25mil. Max supply 50Mil .\n\nCheckout $EUNO http://t.me/EUNOofficial \n\n#EUNO #crypto #Bitcoin #BTC $BTC",17,16
2019-03-30 15:32:59,"While BSV people are busy building things, BCH people are focused on attacking BSV and Craig. If they put their energy in BCH, it would be a great thing for all. I don\xe2\x80\x99t understand why they are obsessed with Craig if he is a fraud. #BCH #BSV #BTC #Bitcoin",78,6
2019-03-30 22:20:48,"Answer to Which cryptocurrency should I invest in, in March 2019? Why? by Chip Smith https://www.quora.com/Which-cryptocurrency-should-I-invest-in-in-March-2019-Why/answer/Chip-Smith-21?ch=2&srid=uCsHd \xe2\x80\xa6\n\n#Crypto #Bitcoin #cryptocurrency #BTC #LTC $Btc",14,5
2019-03-30 21:46:42,#Litecoin in #signlanguage for my friend @MikeKoop ! I promise to keep practicing! \n#IgnitetheFireLTC #PayWithLitecoin #litecoinFam #litecoin #crypto #cryptocurrency #bitcoin #blockchain #LTC #BTC #retweetpic.twitter.com/EHucJTlW7t,54,8
2019-03-30 13:49:15,http://Bitance.com  #valuable domain name is on sale $9000 USD! \nLimited time only! \nBuy it before it is gone!\n\n#domains #names #naming #domaining #crypto #cryptocurrency #cryptocurrencies #bitcoin #bitcoins #btc #bch #bsv #coin #coins #fintech #bit #binance #mining #cryptospic.twitter.com/pQkb5iOg6D,2,4
2019-03-30 20:59:33,I\xe2\x80\x99m gonna give away 1 #Bitcoin #BTC #bitcoin when I reach 5k active followers share this with your friends you may be the lucky #winnerpic.twitter.com/aWmDsEsyaH,11,9
2019-03-30 14:20:45,Le crypto-humour du week-end  http://bit.ly/Humour30mars \n\n#Cryptomonnaie #Crypto #Blockchain #Bitcoin #BTC #Humour,2,2
2019-03-30 21:46:19,Bitcoin: I really think we will see a double Bottom around 3200$ between 27.05.2019 - 01.06.2019..\nSecond scenario is last week of April with a lil bit lower price around 3k! But first one fits my overall bias! What you think @crypToBanger .. #btc #bitcoin #btcusd #crypto pic.twitter.com/tCAPuXo3Dy,99,35
2019-03-30 18:25:48,#Sharding Explained \xe2\x80\x93 Quick Concepts\n\nhttps://www.altcoinbuzz.io/bitcoin-and-crypto-guide/sharding-explained-quick-concepts/ \xe2\x80\xa6\n\n$zil #zilliqa #zil #bitcoin #btc #ethereum #eth #xrp #ripple #bch #ltc #eos #xlm #stellar #ada #cardano #xmr #tron #trx #dash #iota #bnb #neo #crypto #cryptocurrency #blockchain #altcoins #dapps #smartcontracts #techpic.twitter.com/BE5gaPcFI7,18,4
2019-03-30 13:46:38,"More and more people report having problem withdrawing their coins from @hitbtc exchange, I remember I had same problems one year ago. I recommend stay away from that trash exchange. Remember not your keys not your #Bitcoin $BTC\nhttps://bitcoinexchangeguide.com/john-mcafees-exchange-enemy-hitbtc-accused-of-scam-by-bitcoin-developer-luke-dashjr/ \xe2\x80\xa6",8,1
2019-03-30 22:12:55,Bitcoin price Saturday night. \n#cryptocurrencies #blockchain #cryptocoin #cryptocurrency #bitcoin #btc #crypto #cryptonews #cryptotrading #cryptomining #bitcoinnews #cryptolife #ico #hodl\xe2\x80\xa6 https://www.instagram.com/p/Bvphck2gFUm/?utm_source=ig_twitter_share&igshid=11v8sijr5rkpt \xe2\x80\xa6,0,0
2019-03-30 21:09:07,Join us! We are the #CyberRepublic\nhttps://www.cyberrepublic.org \n\n#Elastos #ModernInternet #Internet #smartweb #blockchain #technology #bitcoin #btc #mergemining #DPOS #POW \n\n#OwnYourInternet #SaveOurInternet \nhttps://youtu.be/1LlMPXi-7J4 pic.twitter.com/RAjVbzufPF,37,8
2019-03-30 21:57:30,"#btc #bitcoin\n\ni/ if #btc can maintain local bullish structure, I\'m expecting $4.2K IF it can continue making hh\'s\n\nii/ if #btc breaks bearish& loses the 4-hour market structure, I\'m looking at 3.8K as a dip buy for a quick long scalp into resistance\n\niii/ have a great weekend pic.twitter.com/QW8ywy7eDU",128,26
2019-03-30 16:48:36,Buying the stuff you want is now easier than ever before with BTG! Using BIDALI gift cards you can pay for top brand products and get them shipped to your home.\n-> https://giftcards.bidali.com/buy-giftcards-with-bitcoin-gold \xe2\x80\xa6\n#BitcoinGold #btgpay #Bitcoin #BTC #blockchainpic.twitter.com/okHNz6nX8T,25,3
2019-03-30 21:50:33,Welcome $dash \nBack to $100 again \n\n#dashpay #crypto #cryptocurrencies \n#btc #bitcoin pic.twitter.com/jtcWKEF9u4,49,10
2019-03-30 11:27:25,"icemining pool, everything you need to mine BTG in one place! \n\n  -> https://icemining.ca/site/coins \n\n#icemining #BitcoinGold #Bitcoin #BTG #BTC #GPUmining #Blockchainpic.twitter.com/0IO8oDJfAw",19,4
2019-03-30 20:43:00,What is the least biased cryptocurrency news outlet that brings you balanced and fair news about all cryptocurrencies? \n\n#XRP #BTC #ETH #LTC #XLM #EOS #ADA #TRX #BNB #BCH #XMR #MIOTA #OmiseGO #CryptoNews #cryptocurrency #cryptocurrencies #Crypto #XRPcommunity #bitcoin $XRP $BTC,15,2
2019-03-30 15:14:03,Analysis Shows Lightning Network Suffers From Trust Issues Exacerbated by Rising Fees\nhttps://bit.ly/2Oz3nwJ \n\n#blockchain #blockchainnews #blockchaintechnology #crypto #cryptocurrency #ethereum #bitcoin #btc #bitcoinnews #technologies #latestnewspic.twitter.com/4JneRUsqrm,1,0
2019-03-30 21:11:06,Binance CEO says excessive printing of fiat will lead to cryptocurrency market surge\nhttps://ambcrypto.com/binance-ceo-says-that-excessive-printing-of-fiat-will-lead-to-cryptocurrency-market-surge/ \xe2\x80\xa6\n$BTC #ETH $ETH #Ripple #BTC #Bitcoin #Ethereum $xrp #BitcoinCash #Altcoins,39,16
2019-03-30 18:39:08,Tues April 2nd 7pm #bitcoincash #bch #bitcoin #btc #blockchain #altcoin #wnc #828isgreat #ashevegas #asheville #haynow #wcu #wnc #froglevel #waynesville #maggievalley #haywoodcounty #bchforeveryone #crypto #cryptocurrency #beerpic.twitter.com/tjafWMPhgJ,13,3
2019-03-30 06:52:02,FreeSpin tournament weekend!\n\nFull details here:\nhttps://www.cloudbet.com/en/tournament/bitcoin-promotions-free-spins-tournament_ncb?af_token=9b2795b0ec8cc3fb1d06016a981e1efe \xe2\x80\xa6\n\n#bitcoin #btc #ethereum #eth #litecoin #ltc #bitcoincash #bch #cryptocurrency #crypto #blockchain #ico #altcoins #casino #slots #poker #sportsbet #sportsbetting #cloudbet #betincryptopic.twitter.com/wkkkHd6Lue,1,0
2019-03-30 14:22:54,"Bitcoin (BTC) Surging Above 4,200 Will Mark the End of the Bear Market #bitcoin #BTC #crypto http://bit.ly/2CG65f1 pic.twitter.com/l2dgr5iDZ5",2,0
2019-03-30 20:46:05,TIME FOR THE APRIL 2019 #AI #Blockchain #CryptoStocks #ChartPicks \n\n$BLOK $CUV $DNAX $FORT $GET $GLXY $HIVE $HUT $IBIT $LTV $MOGO $NC $SQR $VHI $VQS $VST\n\n#BottomFishing #PennyStocks #JuniorStocks #SmallCaps #Bitcoin #BTC #Blockchain #Crypto #AiStockspic.twitter.com/Wk8zOEK0ys,6,0
2019-03-30 16:05:56,This could be the first qtr our crypto index isn\xe2\x80\x99t down. Also seeing nice gains on the binance coin this year. #BNB Has the bottom been set for bitcoin... #BTC,11,2
2019-03-30 19:51:40,I just came back from the year 2025 and this was the top post on Reddit by /u/FutureNipple #bitcoin #btc #eth #ethereum #crypto #cryptocurrency #memes #dankmemespic.twitter.com/5xOeJuSA3R,3,0
2019-03-30 17:10:24,Daily #CryptoNews: 30th March 2019\n\n - #Bithumb Hack\n - Indian Crypto Exchange #Coindelta\n - SEC Delays Bitcoin ETF Yet Again\n - #Bitcoin Leads the Crypto Markets \n\n#CryptoNews #Bitcoin #BTC #Blockchain #Crypto #Cryptocurrency pic.twitter.com/QlcK1ibhnk,6,5
2019-03-30 07:08:05,Bithumb hacked? Binance is definitely the safest exchange I have used #Safu #cryptocurrency #crypto #bitcoin #btc #blockchain #binanceangel #USD #altcoin #ethereum #ico #trading #xrp #binance #binanceexchange #bnb #eth #market #news #mining,3,0
2019-03-30 05:52:42,"I\'m convinced #crypto investors coming into the market are not following #cryptotwitter. And that\'s a good thing, lol. #bitcoin $btc #forexsignals.",3,1
2019-03-30 21:59:59,CONGRATULATIONS @cryp2hunter\n\nYou have WON .015 #Bitcoin #BTC for the 200 #Followers #Giveaway!\nPlease send me your address so the winnings can be transferred.\n\nTHANK YOU to everyone who entered this #GIVEAWAY!\nInformation for 300 #Followers #GIVEAWAY is on the way!!https://twitter.com/LWDayTrading/status/1111440892533985280 \xe2\x80\xa6,14,3
2019-03-30 08:59:24,0.0251btc per month or 0.2b5c per year\nOr 0.33btc lifetime Membership\nJOIN NOW AND BENEFIT FROM US\nmessage  http://t.me/alphateamsupport \xe2\x80\xa6 to join premium\n #TRX $TRX #btc #bitcoin ##BTC $ETH #ETH #CryptoTrading #TradingSignals#QKCpic.twitter.com/phHWUf38BE,4,0
2019-03-30 19:49:54,"Why I say people in crypto do it WRONG!\n\nWhen market is in green:  \nThey Say ""Right! Imma gunna buy THE NEXT DIP! "" \n\nWhen market is BLEEDING RED: \nThey Say ""Right Imma Gunna just wait for this to go lower!?""\n\n#Crypto #Bitcoin #cryptocurrency #BTC #LTC $Btc pic.twitter.com/2S8d2KvOFx",14,1
2019-03-30 21:17:44,Is that you bitcoin? $BTC #bitcoin https://twitter.com/GerdaJanssen5/status/1109249649511145472 \xe2\x80\xa6,1,0
2019-03-30 17:22:01,"Bitcoin\'s limited supply is a *feature*, not a flaw. Central Bank money printing and the horrors of hyper inflation and its devaluation of savings was the impetus for Bitcoin...\n\nhttps://bitcoinist.com/cme-chairman-admits-bitcoins-finite-amount-is-a-problem/ \xe2\x80\xa6 #Bitcoin $BTC #CME #satoshi #Fed #crypto",3,0
2019-03-30 20:22:00,"For those new to the crypto scene, one of the most important first steps is finding the right wallet to store their coins. We take a look at 5 different wallet types that they can consider. \n\nhttps://www.coinbureau.com/education/types-of-crypto-wallets/ \xe2\x80\xa6 #crypto #wallets #bitcoin $BTC #beginners #guide",2,0
2019-03-30 23:00:29,#BTCUSD Market #1H timeframe on  March 30 at 22:00 (UTC)  is #Bullish.  #cryptocurrency #bitcoin #btc #crypto #trading #idea #report technical analysis,1,0
2019-03-30 09:32:28,Bitcoin [BTC] Leads the Crypto Markets As Altcoin Traders Await A Definite Move\n\n#Bitcoin #BTC $BTC #Ethereum #ETH $ETH #XRP $XRP #Litecoin #OmiseGo #OMG $OMG #Cryptocurrency #Crypto #Altcoinhttps://coingape.com/market-update/ ,3,1
2019-03-30 10:05:30,Imagine when all these currencies combined chase the same 1 #Bitcoin #BTC  pic.twitter.com/I5oZ9ua4UN,3,0
2019-03-30 18:39:27,Tues April 2nd 7pm #bitcoincash #bch #bitcoin #btc #blockchain #altcoin #wnc #828isgreat #ashevegas #asheville #haynow #wcu #wnc #froglevel #waynesville #maggievalley #haywoodcounty #bchforeveryone #crypto #cryptocurrency #beerpic.twitter.com/iTv6dYt7FS,5,0
2019-03-30 14:05:39,That #cryptocurrecy hit different when u can #spend it ..... \n\n#SHOUTOUT to @spendcard #spendcard the #future is #now\n\n#bitcoin #btc #ethereum #eth #ripple #xrp #stellar #xlm #tron #trx #digital #money #crypto #VISA #CREDITCARD #DEBIT #BANK\n\n#CryptoCickTRON #LIFEisCICKpic.twitter.com/vsVbEAkcpz,5,2
2019-03-30 22:38:21,Thanks a lot for all the support the past few months to @99BitcoinsHQ on the end stretch of The Google+ Bitcoin Community.  Which in turn has made http://99bitcoins.com  the Top supporter of it vs 25 other Bitcoin startups in the last 6+ years.  Truly grateful #bitcoin #btc #xbt,3,0
2019-03-30 04:59:39,Gonna get hate for that but don\'t care I\'m drunk:\n$crypto twitter is the slowest learning curve ever. I\'m actually amazed by how it has not smarten up one bit in 3 years. Actually got dumber. And I love it cause I laugh every day .\n\n#bitcoin $BTC #btc #crypto $eth,2,0
2019-03-30 21:47:54,Read #Crypto & #Forex news: https://bitcoin.cartel.click \n\nThe Rolling Stones postpone their April tour so Mick Jagger can receive medical treatment http://www.marketwatch.com/news/story.asp?guid=%7B2329FB92-52F1-11E9-854D-3520F3F4FAAB%7D&siteid=rss&rss=1 \xe2\x80\xa6 #Bitcoin #Btc #Cryptocurrency,1,0
2019-03-30 15:26:13,"Bitcoin (BTC) Price Following Steady Uptrend, Dips Remain Attractive #BTC #BTCUSD #bitcoin #bitcoincash #bitcoinnews #crypto #cryptocurrency #cryptocurrencies #digitalcurrency #digitalcurrencies https://www.newsbtc.com/2019/03/30/bitcoin-btc-price-following-steady-uptrend-dips-remain-attractive/ \xe2\x80\xa6",1,0
2019-03-30 22:55:04,"Options Traders Show Little Confidence in Bitcoin Hitting $10,000 This Year https://www.cryptoglobe.com/latest/2019/03/options-traders-show-little-confidence-in-bitcoin-hitting-10000-this-year/ \xe2\x80\xa6 #Bitcoin $BTC #Crypto #Cryptocurrency",1,0
2019-03-30 21:26:12,This is governments trying to regulate bitcoin.\n\n http://ElixiumCrypto.com/19/  \n\nRegister Now & Start Buying & Selling Cryptocurrency \n\n#Crypto #Cryptocurrency #Bitcoin #BTC #Ethereum #ETH #Ripple #XRP #EOS #Stellar #Litecoin #LTC #Cardano #Monero #TRON #IOTApic.twitter.com/5VyXtGQoPJ,6,3
2019-03-30 21:14:08,We still have a long way to go! \nNever give up #Crypto - @CoinMarketCap\n\n#cryptoengineering #cryptocurrency #bitcoin #btc pic.twitter.com/nXpUwEGXCn,6,4
2019-03-30 18:13:25,"[Not Surprisingly], a U.S. Bank Bans Customers From Buying Bitcoin https://www.newsbtc.com/2019/03/30/not-surprisingly-a-u-s-bank-bans-customers-from-buying-bitcoin/ \xe2\x80\xa6 #BTC #Bitcoin #bitcoinnews #Banks #Banned",0,0
2019-03-30 17:32:42,PSA: DO NOT BUY $RPM on @MetcatoxCom!!! That is the old erc-20 token and #Repme has now swapped to it\'s own chain that can only be bought at @StexExchangeR with BTC pair.\n\n#crypto #cryptocurrency #bitcoin #btc $btc,14,9
2019-03-30 14:48:07,Which crypto trading platform offers the best crypto technical analysis tools for free? #Bitcoin #BTC #BTCUSD #Ripple #XRP #Ethereum #ETH #cryptocurrency #Crypto #Cryptotrading #EOS #XLM #TechnicalAnalysis #Bitconanalysis https://www.cryptocointrade.com/education/technical-analysis/ \xe2\x80\xa6pic.twitter.com/fwihC4BzeV,1,0
2019-03-30 20:36:01,Veriblock blockchain goes live on Bitcoin mainnet https://twi.li/VMHg12  #Blockchain #bitcoin #BTC #veriblockpic.twitter.com/B6uGF3kjor,2,1
2019-03-30 23:55:22,Top Five Altcoins with Negative Price Correlations to Bitcoin (BTC) in the Last Year http://bit.ly/2uCFEme  #bitcoin #crypto #blockchain #btc #news pic.twitter.com/dFc8zKWHkO #eth #ltc #xrp,0,0
2019-03-30 23:33:03,BITCOIN showing SECRET DIVERGENCE As It Moves Higher! BTC Technical Analysis \nhttps://youtu.be/yXBA-ttDGBk \n$trx $tron $BTC $ripple $XRP $ETH $ADA $bch $XVG #Ripple #XRP #TRX #Coinbase #eos #cardano #bnb #crypto #cryptocurrency #eth #ethereum #bitcoin #binance #bitcoin #btc #eos,2,0
2019-03-30 22:49:05,"The \xe2\x80\x9cConservative\xe2\x80\x9d Case For A Bitcoin (BTC) Rally To $50,000 https://ift.tt/2TLFUcG  #bitcoin #blockchain #cryptocurrency #BTC #ICO #ethereum #eth #doge #xrp #ltc #crypto #fintech @BIGMONEYMIKE6 @justinsuntron #TEAMBILLIONAIRE #BMM #MONEYGANG #profits #forex #mmj $AAPL #steem $\xe2\x80\xa6pic.twitter.com/bGbrBF5E1K",2,0
2019-03-30 22:35:20,"All Eyes On $4,200 As Bitcoin (BTC) Continues Bullish Assault http://bit.ly/2WyAy6k  #bitcoin #crypto #blockchain #btc #news pic.twitter.com/D1PrQRjQkX",1,0
2019-03-30 22:05:58,Current Bitcoin (BTC) Price: $4109.84 USD   The Bitcoin (BTC) Price a year ago on 2018-03-29: $7086.49 USD   #bitcoin pic.twitter.com/Q8vQyAcbWB,0,0
2019-03-30 23:35:27,Top Five Altcoins with Negative Price Correlations to Bitcoin (BTC) in the Last Year http://bit.ly/2uCFEme  #bitcoin #crypto #blockchain #btc #news pic.twitter.com/fX4Ho8Ip1r,0,0
2019-03-30 22:35:31,"All Eyes On $4,200 As Bitcoin (BTC) Continues Bullish Assault http://bit.ly/2WyAy6k  #bitcoin #crypto #blockchain #btc #news pic.twitter.com/lp5Xhkkrva #eth #ltc #xrp",0,0
2019-03-30 21:58:35,Financial advisors only need to be educated on Bitcoin (BTC) to turn from skeptics to believers. #blockchain #dlt #bitcoin #btc #crypto #digitalsecurities #dlbxhttps://lnkd.in/gp3MeKY ,2,0
2019-03-30 21:05:08,"The \xe2\x80\x9cConservative\xe2\x80\x9d Case For A Bitcoin (BTC) Rally To $50,000 by Nick Chong : aggregated via http://bitcoinadvice.com  #bitcoin $BTC #crypto",0,0
2019-03-30 21:00:02,"Tomorrow\'s Bitcoin(BTC) forecast is\n        \n\xe2\x96\xb3UP 71% \n\xe2\x96\xbcDOWN 29%\n\n#Bitcoin, #BTC\n\nBitcoin Forecast (iOS)\nhttps://itunes.apple.com/app/id1404198250 \xe2\x80\xa6pic.twitter.com/NwjBBJo75a",0,0
2019-03-30 19:13:32,Bitcoin Bull Rally in 2019 is Doubtful; Analyst Reports.\n\n#bitcoin #bitcoinprice #bitcoinnews @RedditBTC @Bitcoin @btc \n\nhttps://www.coinmarketfeed.com/news/bitcoin-bull-rally-in-2019-is-doubtful-analyst-reports \xe2\x80\xa6,2,1
2019-03-30 19:07:01,"Solid Progress: Bakkt Continues Work On Bitcoin (BTC) Futures, Unveils Stacked Board $BTC $BTCUSD #btc #bitcoin https://goo.gl/FifQpU ",0,0
2019-03-30 18:03:30,PSA: DO NOT BUY $RPM on @MetcatoxCom!!! That is the old erc-20 token and #Repme has now swapped to it\'s own chain that can only be bought at @StexExchangeR with BTC pair.\n\n#crypto #cryptocurrency #bitcoin #btc $btc,1,0
2019-03-30 18:00:01,"IAM Platform Curated Retweet:\n\nVia: https://twitter.com/TheBitcoinNews \n\nBitcoin (BTC) Has a Market Dominance of 80%, Study Concludes - http://bit.ly/2TtPtwA \n #bitcoin #btc #bitcoinnews #blockchain pic.twitter.com/ELfr6ksTGn\n\n#IAMPlatform\n#TopInfluence\n#BlockChainNews",0,0
2019-03-30 17:19:21,"Bitcoin (BTC) Price Following Steady Uptrend, Dips Remain Attractive - newsBTC: Bitcoin (BTC\xe2\x80\xa6 https://goo.gl/fb/dFYsh6  #Bitcoins #News",0,0
2019-03-30 17:02:44,#MinuteCrypto #Bitcoin $BTC $Cryptopic.twitter.com/27lcgltbwc,9,2
2019-03-30 07:10:42,What was your coin of choice today? \n.\n.\n#cryptocurrency #crypto #bitcoin #btc #blockchain #binanceangel #USD #altcoin #ethereum #ico #trading #xrp #binance #binanceexchange #bnb #eth #market #news #mining,2,0
2019-03-30 06:19:11,Crypto Exchanges Are NOT Your Banks. A Cold Storage Card is your own Bank. \n\nBitcoin (BTC) Cold Storage Card\n\nonly available at https://www.247bits.com/ \n\n$BTC #BTC #Bitcoin #247Bits #PayWithCrypto @BTCTN @Bitcoin @BitcoinMagazine\n\nOver 30 #Crypto Payments accepted pic.twitter.com/xjqSb49ou1,2,1
2019-03-30 04:29:40,#BitcoinCashABC #BCHABC/#BTC\n#TDSequential > 4h chart: MORE DOWNTREND EXPECTED! \n#sequencial strong red 1 of 9 breaks previous green TDST resistance\n\n#bitcoin #btc #crypto #altcoin #trading #analysis\n(no financial advice)pic.twitter.com/y9aJYH3Vob,0,0
2019-03-30 04:23:25,"Bitcoin (BTC) Has a Market Dominance of 80%, Study Concludes - http://bit.ly/2TtPtwA \n #bitcoin #btc #bitcoinnews #blockchainpic.twitter.com/52tn2EKYlV",0,0
2019-03-30 04:18:11,Don\xe2\x80\x99t tell me bitcoin wont hit 100k..\n\nWe now have ostrich robots loading pallets in warehouses\n\nhttps://youtu.be/5iV_hB08Uns \n\n#ltc #litecoin #bitcoin #btc @APompliano,19,5
2019-03-30 04:08:09,Do you think @CNBCFuturesNow should STOP publishing trades on $crypto such as #Bitcoin $BTC and #Ethereum $ETH? \n\nBy stop publishing trades I really meant @CNBCFuturesNow to stop publishing your contrarian signals,3,1
2019-03-30 03:23:11,Bitcoin Payments Surge to New Record: Here\xe2\x80\x99s the Real Trigger https://www.ccn.com/bitcoin-payments-surge-to-new-record-heres-the-real-trigger \xe2\x80\xa6\n\n#crypto #CryptoNews #Cryptocurrency #bitcoin #btc \n@amruthasuri @ToneVays @BigChonis @uzgaroth @_blockandchain_,3,3
2019-03-30 03:13:38,"Solid Progress: #Bakkt Continues Work On #Bitcoin (#BTC) Futures, Unveils Stacked Board - Businessdaylight  https://www.businessdaylight.co.uk/2019/03/30/solid-progress-bakkt-continues-work-on-bitcoin-btc-futures-unveils-stacked-board/ \xe2\x80\xa6",4,0
2019-03-30 03:12:28,"Crypto Bulls Push BTC Above $4,100 As SEC Delays Decisions on Bitcoin ETFs\n\n#Crypto #Bitcoin #BTC $BTC #BitcoinETFhttps://dailyhodl.com/2019/03/29/crypto-bulls-push-btc-above-4100-as-sec-delays-decisions-on-bitcoin-etfs/ \xe2\x80\xa6",4,0
2019-03-30 03:10:02,"Bitcoin BTC Current Price:\n$4,118.32\n1 Hour: 0.24 % | 24 Hours: 1.05 % | 7 Days: 2.08 %\n#btc #bitcoin",0,1
2019-03-30 02:54:49,"Bitcoin (BTC) Breaks Below 4,000 as Analysts Expect Continued Near-Term Weakness\nhttps://tribetica.com/bitcoin-btc-breaks-below-4000-as-analysts-expect-continued-near-term-weakness/ \xe2\x80\xa6\n\nhttp://reddit.com/r/tribetica \n#newsoftheweek #Bitcoin #blockchain #crypto pic.twitter.com/QpimoVMUEW",2,1
2019-03-30 02:51:25,Online @chaturbate  Join me! https://onelink.cam/TiffRoyal  \n#Chaturbate #chaturbatemodel #bitcoin #BTC #Friday #blockchain #cryptocurrency #cryptofriendly #camgirl #cammodel #altcoins \n@RoyalTiffanyFP \n@YNOTLAJ\n@ChaturbateGirlz @ChaturbateGrls @ChaturbateBabespic.twitter.com/8QG5OLqf7e,6,3
2019-03-30 02:21:09,It would be so easy then\n\n http://ElixiumCrypto.com/24/  \n\nRegister Now & Start Buying & Selling Cryptocurrency \n\n#Crypto #Cryptocurrency #Bitcoin #BTC #Ethereum #ETH #Ripple #XRP #EOS #Stellar #Litecoin #LTC #Cardano #Monero #TRON #IOTA #Dash #Tezospic.twitter.com/GpCtfOud9m,4,2
2019-03-30 01:57:30,THE ANSWER EVERYONE WOULD LOVE TO KNOW...\nWHEN WILL #BITCOIN #MOON?? \n\nI\'ve given my personal opinion on the matter...\nbut would love to hear what everyone else thinks! \n\nWhen do you believe #Bitcoin #BTC will break the All Time High??\n\n#Crypto #XRP #LTC #ETH,3,0
2019-03-30 01:42:02,"1 Bitcoin ( #BTC )\nDollar: 4114.06$ \n\n1 Bitcoin Cash ( #BCH )\nDollar: 1,70.32$ \n\n1 Ethereum ( #ETH )\nDollar: 144.86$ \n\n1 Ripple ( #XRP )\nDollar: 0.30740$ \n\nDate: 30 Mar 2019 1:41\n\n#Bitcoin #Ethereum #cryptocurrency #crypto #altcoin #Blockchain #Ripple",0,0
2019-03-30 01:26:25,@bitconner just confirmed his topic for the #boltathon. Here\'s a clue:\n+=  \n\nGet your tickets now people! \n#Bitcoin $BTC #LightningNetwork\n\nhttps://boltathon.com/sessions/#/tickets \xe2\x80\xa6,13,7
2019-03-30 01:05:17,"$BSV claims the Bitcoin name, because of the white paper.\n\n$BCH claims the Bitcoin name because of the white paper\'s title.\n\n$BTC claims the Bitcoin name because of the ticker symbol, and not the white paper at all.\n\n#bitcoinsv #bitcoincash #bitcoin",62,18
2019-03-30 01:00:02,"Tomorrow\'s Bitcoin(BTC) forecast is\n        \n\xe2\x96\xb3UP 93% \n\xe2\x96\xbcDOWN 7%\n\n#Bitcoin, #BTC\n\nBitcoin Forecast (iOS)\nhttps://itunes.apple.com/app/id1404198250 \xe2\x80\xa6pic.twitter.com/mcZTAByIbp",0,0
2019-03-30 00:56:05,#Crypto #cryptocurrency #bitcoin #btc #Blockchain #win #xrp #ethereum #eth $tron #Dogecoin #free #news #Giveaway #trx #xmrpic.twitter.com/V4VLVQ7anY,2,1
2019-03-30 00:54:33,Yes. $OSTK & $HVBTF are the only two publically traded companies with large exposure to #Crypto #Bitcoin $BTC #Ethereum $ETH market that is about to  .\n\n$SQ has a little ... yeah we got that also  we  @jack\n\n@tzeroblockchain @medici_ventures @Overstock @HiveBlockchain,4,0
2019-03-30 00:37:58,"$BTC #Bitcoin 12 hour - As $BTC continues to push, all eyes on Feb 24th ""shooting star"" pic.twitter.com/g9o6J4P78B",46,6
2019-03-30 00:28:19,Join us on Telegram! We added the H2ox bot so we can tip coins with no fees it connects right with your H2ox account ! \nhttp://t.me/waves_shark \n\nH2ox site if you need to join!  \nhttps://h2ox.io/F6_LVB1U4D7LXPUUA \xe2\x80\xa6\n\n#Waves #wavesplatform #crypto #Cryptocurrency #Bitcoin #BTC #Blockchain,3,1
2019-03-30 00:27:02,"Analyst: Bitcoin (BTC) Surging Above 4,200 Will Mark the End of the Bear Market https://www.cryptomak.co.uk/analyst-bitcoin-btc-surging-above-4200-will-mark-the-end-of-the-bear-market/?utm_source=dlvr.it&utm_medium=twitter \xe2\x80\xa6 #Bitcoin #Cryptocurrency #BTC #Crypto",0,0
2019-03-30 00:23:24,"Bitcoin (BTC) Has a Market Dominance of 80%, Study Concludes - http://bit.ly/2TtPtwA \n #bitcoin #btc #bitcoinnews #blockchainpic.twitter.com/kVf57ibrGL",1,0
2019-03-30 00:20:16,Sharp Bitcoin Rally in 2019 Unlikely: Analyst by Aaron Wood : aggregated via http://bitcoinadvice.com  #bitcoin $BTC #crypto,0,0
2019-03-30 00:16:47,Analysis Shows Lightning Network Suffers From Trust Issues Exacerbated by Rising Fees https://news.bitcoin.com/analysis-shows-lightning-network-suffers-form-trust-issues-exacerbated-by-rising-fees/ \xe2\x80\xa6 #blockchain #bitcoin #btc,1,0
2019-03-30 00:14:30,#bitcoin #btc still trying to break a strong point of resistance. Has held since we recovered from the fall from 6k pic.twitter.com/DCvKFPVkOZ,0,0
2019-03-30 00:11:58," MARKET EXPIRED: ""What will be the price of #Bitcoin (BTC) in USD at 12am UTC on March 30, 2019?"" (3,200.25 USD - 4,800.37 USD) https://app.veil.co/market/btc-usd-2019-03-30-5x \xe2\x80\xa6 #crypto",0,0
2019-03-30 00:10:06,"Bitcoin BTC Current Price:\n$4,095.70\n1 Hour: 0.18 % | 24 Hours: 0.66 % | 7 Days: 1.57 %\n#btc #bitcoin",0,0
